created_at,tweet,language,mentions,urls,photos,replies_count,retweets_count,likes_count,hashtags,cashtags
2021-01-10 19:25:34 EST,I was just rewarded with $20 USD in Stellar Lumens $XLM and Celo Gold $CGLD from watching ten 2-minute videos on @Coinbase.com. Any eligible user in the world can earn that &amp; more! Check it out:  https://t.co/OCYMCS82DL and  https://t.co/FOSEtLfs62 #Crypto #Rewards $BTC #bitcoin,en,"[{'screen_name': 'coinbase', 'name': 'coinbase', 'id': '574032254'}]","['https://coinbase.com/earn/xlm/invite/d5qwt61j', 'https://www.coinbase.com/rewards']",[],1,0,1,"['crypto', 'rewards', 'bitcoin']","['xlm', 'cgld', 'btc']"
2021-01-10 17:34:34 EST,Stellar Lumens 왜캐 올랐냐 ...............내가 저거 분명 0.00 몇일때 샀던거 같은데 아 몇 100코인 샀던거...다 어디갔서......ㅠㅠㅠㅠㅠㅠㅠㅠㅠㅠㅠㅠㅠㅠㅠㅠㅠㅠㅠㅠㅠㅠ시부렁탱........거래 환전소...어디갔써 진심..기억해내 똥멍충이,ko,[],[],[],0,0,0,[],[]
2021-01-10 17:32:39 EST,Stellar Lumens - Possible bullish pennant. Waiting for breakout confirmation ($0.32 would do it) #cryptocurrencies   #BTC #LTC #ETH #XRP #Crypto  https://t.co/w2yyLjROvk,en,[],[],['https://pbs.twimg.com/media/ErZ4QSLWMAAoJeH.png'],7,10,76,"['cryptocurrencies', 'btc', 'ltc', 'eth', 'xrp', 'crypto']",[]
2021-01-10 17:30:24 EST,Predicciones para el precio de Stellar Lumens (XLM) en 2021  👀👇👇   https://t.co/e7kn8GplWK,es,[],['https://criptoinforme.com/criptomonedas/predicciones-para-el-precio-de-stellar-lumens-xlm-en-2021/'],[],0,0,2,[],[]
2021-01-10 17:07:38 EST,"@Price_Cap_UA Это значит что банковский сектор переходит на иной уровень. Для перехода выбрали stellar lumens. Это монета такая и конечно же не просто монета, а технология. Для рядового порохолиза это ничего не меняет и не о чем не говорит. Так как оно всегда  предпочтет бусы...",ru,[],[],[],1,0,1,[],[]
2021-01-10 17:06:31 EST,Could someone maybe read this and then explain it to me! 🤷 #xlm $xlm #stellarorg #stellarlumens #stellar #lumens   https://t.co/OefXiJZ7sZ,en,[],['https://www.forexcrunch.com/stellar-price-prediction-xlm-usdt-primed-for-a-rally-towards-10-mark/'],[],4,0,6,"['xlm', 'stellarorg', 'stellarlumens', 'stellar', 'lumens']",['xlm']
2021-01-10 16:59:53 EST,"@DragonsDen93 It’s definitely gonna correct sooner rather than later I think. I’ve put my money into Stellar Lumens, think that’s gonna be the next one to go big. Been in the news a lot lately too.",en,[],[],[],2,0,0,[],[]
2021-01-10 16:47:15 EST,I can't wait for next week! #xlm $xlm #stellarorg #stellarlumens #stellar #lumens  https://t.co/wHxb2YZ2gp,en,[],[],['https://pbs.twimg.com/media/ErZt3ruW8AUOjzK.jpg'],7,5,35,"['xlm', 'stellarorg', 'stellarlumens', 'stellar', 'lumens']",['xlm']
2021-01-10 16:41:07 EST,@KimDotcom XLM (Stellar Lumens) is much faster &amp; lower cost.,en,[],[],[],0,0,1,[],[]
2021-01-10 16:36:29 EST,"@Entr3ri0 @EricPresidentVR best time to start is always ""now."" Plenty of interesting coins out there which aren't already at 40k. I like BAT, ETH, Stellar Lumens.",en,[],[],[],1,0,0,[],[]
2021-01-10 16:09:46 EST,Le previsioni per il prezzo di Stellar Lumens (XLM)  https://t.co/QLgofuLTBX   #Stellar #XLM #cryptocurrencies,it,[],['https://cryptonomist.ch/2021/01/10/previsioni-prezzo-stellar-lumens-xlm/'],[],0,1,1,"['stellar', 'xlm', 'cryptocurrencies']",[]
2021-01-10 15:22:03 EST,"Bitcoin, Ethereum, Ripple, Stellar Lumens &amp; Chainlink  https://t.co/2mtzc3jMMN  https://t.co/1WKt6ZKN39",en,[],['http://dlvr.it/RqHvHc'],['https://pbs.twimg.com/media/ErZaXkyU0AEvVau.jpg'],0,0,0,[],[]
2021-01-10 15:05:56 EST,Just converted all the free crypto I just got from Coinbase  (besides stellar lumens and makerdao) to Bitcoin to buy this dip,en,[],[],[],0,0,4,[],[]
2021-01-10 15:03:29 EST,Crypto argent de poche gratos 50$ de XLM ( STELLAR LUMENS) : #cryptomonnaie #XLM #StellarLumens  https://t.co/jHic5v2U5d,fr,[],['https://coinbase.com/earn/xlm/invite/64w8rt7'],[],0,0,2,"['cryptomonnaie', 'xlm', 'stellarlumens']",[]
2021-01-10 14:44:12 EST,@Kevin_Cage_ Stellar Lumens for the win!!,en,[],[],[],0,0,1,[],[]
2021-01-10 14:11:12 EST,@Shanti__Ananda Thanks for the reminder! Just checked my keybase. I've got USD$400 in stellar lumens that were spacedropped to me for free. I should probably use it to short bitcoin.,en,[],[],[],1,0,1,[],[]
2021-01-10 14:02:50 EST,STELLAR LUMENS $XLM EXPLODES IN PRICE! NEW ALL TIME HIGHS INCOMING WITH GEMS!!  Check it out now!   https://t.co/ftqYlrkICb,en,[],['https://youtu.be/YL5t-XphAYg'],[],1,0,8,[],['xlm']
2021-01-10 13:54:06 EST,@HenHillbilly stellar lumens xlm like  xrp's sister good one to hold and the price is awesome! hold don't be scared if the price drops just buy more you won't regret.,en,[],[],[],1,0,1,[],[]
2021-01-10 13:44:00 EST,IMPORTANT Video on Stellar Lumens $XLM out in 15 mins!  Stay tuned!! 🔥  Altseason approaching...,en,[],[],[],1,1,22,[],['xlm']
2021-01-10 13:04:47 EST,Coinbase alt options (update) 🔵 $link -  TEH Oracle solution🧊 $grt - index api $atom - web3 $oxt - orchid / p2p Internet $xlm - stellar lumens / cross-asset transfer $lrc - loop ring / scaling sol for eth / gas fee reduction $snx - synthetic asset trading,en,[],[],[],0,0,3,[],"['link', 'grt', 'atom', 'oxt', 'xlm', 'lrc', 'snx']"
2021-01-10 12:51:41 EST,"@LynAldenContact XLM (Stellar Lumens) seems to be an inexpensive, fast way to send small payments.",en,[],[],[],0,0,0,[],[]
2021-01-10 12:36:33 EST,May Stellar Lumens XLM marks the start of the Altseason?  https://t.co/m8Y3Gdw3Hk,en,[],['https://coinup24.com/may-stellar-lumens-xlm-marks-the-start-of-the-altseason/'],[],0,0,0,[],[]
2021-01-10 11:41:46 EST,Stellar Lumens XLM Price Prediction (8 Jan 2021)  https://t.co/eSsGddvdmw via @YouTube,fr,"[{'screen_name': 'youtube', 'name': 'youtube', 'id': '10228272'}]",['https://youtu.be/JR8Y6JUCzXw'],[],0,0,0,[],[]
2021-01-10 11:26:00 EST,Stellar Lumens: FinCEN Regulatory Proposal May Have “Far-Reaching Consequences for Blockchain and Crypto”  https://t.co/lMOlBV3Wtu,en,[],['https://www.bitcoinvestments.net/stellar-lumens-fincen-regulatory-proposal-may-have-far-reaching-consequences-for-blockchain-and-crypto'],[],0,0,0,[],[]
2021-01-10 11:15:49 EST,In love with Stellar Lumens.,en,[],[],[],0,1,6,[],[]
2021-01-10 11:14:08 EST,@elonmusk buy stellar lumens @StellarOrg,en,"[{'screen_name': 'stellarorg', 'name': 'stellar', 'id': '2460502890'}]",[],[],0,0,0,[],[]
2021-01-10 10:40:01 EST,"$XLM Stellar Lumens (XLM) Price Prediction (Prediction) 2021, 2025, 2030  #XLM #StellarLumens #prediction   https://t.co/dMmloA17ch",fr,[],['https://www.8sa.net/stellar-lumens-xlm-price-prediction-prediction-2021-2025-2030/'],[],0,0,1,"['xlm', 'stellarlumens', 'prediction']",['xlm']
2021-01-10 09:55:09 EST,"1. What is Stellar? A descentralized protocol that unites the world´s financial infrastructure. 2. What are Stellar Lumens (XLM) used for? Facilitating low-cost, universal payments. 3. Why is Stellar good for sending remittances? Transactions are fast, inexpensive, and global.",en,[],[],[],1,0,1,[],[]
2021-01-10 09:11:30 EST,$XLM Stellar Lumens (XLM) Fiyat Tahmini (Prediction) 2021 - 2030  #XLM #Stellar #prediction   https://t.co/aK0GvqCucy,in,[],['https://www.onlinekredi.com/stellar-lumens-xlm-fiyat-tahmini-2020-2021-2025-2030/'],[],0,0,1,"['xlm', 'stellar', 'prediction']",['xlm']
2021-01-10 07:46:01 EST,@elonmusk  hey dad thoughts on stellar lumens ? #XLM,en,[],[],[],0,0,2,['xlm'],[]
2021-01-10 07:23:23 EST,#BLU Satoshipay  There are many #crypto coins but the one that integrates and solves CURRENT problems (cheap/cross border payments/tiny fees) and is backed by CURRENT financial institutions gets my vote.  What is #XLM #Stellar Lumens?  https://t.co/iRe5v4hAag via @YouTube,en,"[{'screen_name': 'youtube', 'name': 'youtube', 'id': '10228272'}]",['https://youtu.be/-u2RCOWxKww'],[],0,2,7,"['blu', 'crypto', 'xlm', 'stellar']",[]
2021-01-10 07:21:48 EST,@XVG_Holder Stellar lumens also.😜😜😜,it,[],[],[],0,0,1,[],[]
2021-01-10 05:22:43 EST,The predictions for the price of Stellar Lumens (XLM)  https://t.co/3vdN03KR8G,en,[],['https://maxbit.cc/the-predictions-for-the-price-of-stellar-lumens-xlm/'],[],0,0,0,[],[]
2021-01-10 04:24:13 EST,The predictions for the price of Stellar Lumens (XLM)  https://t.co/bqCWW0IUcD,en,[],['https://en.cryptonomist.ch/2021/01/10/predictions-price-stellar-lumens-xlm/'],[],0,1,1,[],[]
2021-01-10 03:49:55 EST,$XLM Stellar Lumens,in,[],[],[],0,0,2,[],['xlm']
2021-01-10 03:39:08 EST,https://t.co/EZFwll2UkN What is Stellar Lumen ? The XLM Coin - Cryptocurrencies on Coinbase - Crypto Mission to the moon #StellarLumens #XLMUSDT #Coinbase #coinbaseearn #cryptocurrency #cryptocurrencies #Crypto  Join the Coinbase:  https://t.co/zJCxp0PN3M,en,[],"['https://www.youtube.com/watch?v=nmrHBwcmIis', 'https://coinbase.com/join/lappen_7']",[],1,0,1,"['stellarlumens', 'xlmusdt', 'coinbase', 'coinbaseearn', 'cryptocurrency', 'cryptocurrencies', 'crypto']",[]
2021-01-10 03:34:21 EST,"@BrightDriz Stellar Lumen, SORA, XRT, AKRO, SNX, RenVM, Band Protocol.  The aim should be getting in to crypto and not getting hit by FOMO. 🤷🏽‍♂️",en,[],[],[],0,0,1,[],[]
2021-01-10 02:17:23 EST,Earn cryptocurrency Stellar Lumens free at Coinbase by watching 3 short lessons. Follow link below.  https://t.co/Vm3JgbghMB,en,[],['https://coinbase.com/earn/xlm/invite/1wjcmyh9'],[],0,0,0,[],[]
2021-01-10 02:09:50 EST,The predictions for the price of Stellar Lumens (XLM)   https://t.co/QBYxRqKoZ4,en,[],['https://en.cryptonomist.ch/2021/01/10/predictions-price-stellar-lumens-xlm/'],[],0,0,0,[],[]
2021-01-10 02:04:03 EST,Update XLM (Stellar Lumens) BTC – Zoom in 15m – Looks good  https://t.co/pi37YbGtHw #bitcoin  https://t.co/nexa78Hf1t,en,[],['https://thebitcoinstreetjournal.com/update-xlm-stellar-lumens-btc-zoom-in-15m-looks-good/'],['https://pbs.twimg.com/media/ErWjuOxXIAIrFtP.png'],0,0,1,['bitcoin'],[]
2021-01-10 02:01:22 EST,"Stellar Lumens, Tron, Algorand Fiyat Analizi- Önemli Destek ve Dirençler!  https://t.co/kif29ST3jZ",tr,[],['https://coinotag.com/stellar-lumens-tron-algorand-fiyat-analizi-onemli-destek-ve-direncler/'],[],0,0,6,[],[]
2021-01-10 01:23:48 EST,"Bitcoin, Ethereum, Cardano, litecoin, maker, stellar lumens, magic, algorand, xrp #letsgo #justdoit",en,[],[],[],0,0,2,"['letsgo', 'justdoit']",[]
2021-01-10 01:23:17 EST,"@CryptoFinally Real men save money and don't pay high transactions fees of BTC or ETH, so they can buy their beautiful queen a big giant diamond instead.  Harmony ONE and Stellar Lumens transaction fees are less than 0.25% of ETH.",en,[],[],[],0,0,0,[],[]
2021-01-10 01:19:21 EST,@StellarOrg @StellarOrg BETTER THAN ALL THE REST!😎👌👌👌💯🥂 . . . #STELLAR #StellarLumens #BESTAltcoin #CRYPTO #cryptocurrency #Lumens #STELLARBetterThanAllTheRest #STELLARLumensBetterThanAllTheRest #FutureCRYPTO  https://t.co/57TYS0trfL,en,[],[],['https://pbs.twimg.com/media/ErWZfRUVcAMJiDY.jpg'],0,0,0,"['stellar', 'stellarlumens', 'bestaltcoin', 'crypto', 'cryptocurrency', 'lumens', 'stellarbetterthanalltherest', 'stellarlumensbetterthanalltherest', 'futurecrypto']",[]
2021-01-10 01:17:41 EST,@StellarOrg BETTER THAN ALL THE REST!😎👌👌👌💯🥂 . . #STELLAR #StellarLumens #BESTAltcoin #CRYPTO #cryptocurrency #Lumens #STELLARBetterThanAllTheRest #STELLARLumensBetterThanAllTheRest #FutureCRYPTO  https://t.co/q8sDNBBfBu,en,[],[],['https://pbs.twimg.com/media/ErWZG8CVgAMLGbt.jpg'],0,0,0,"['stellar', 'stellarlumens', 'bestaltcoin', 'crypto', 'cryptocurrency', 'lumens', 'stellarbetterthanalltherest', 'stellarlumensbetterthanalltherest', 'futurecrypto']",[]
2021-01-10 01:14:43 EST,"@TheMoonCarl Harmony ONE, Stellar Lumens XLM, Vechain VET, Engin ENJ, Cardano ADA, Matic Network and Ripple XRP.",en,[],[],[],0,0,2,[],[]
2021-01-09 23:16:11 EST,@BiloSelhi1 Stellar Lumens... actually buying more right now!😂,en,[],[],[],0,0,0,[],[]
2021-01-09 22:30:41 EST,XLM Stellar Lumens baby,in,[],[],[],0,0,2,[],[]
2021-01-09 22:23:07 EST,#XLM /USD has made a perfect cup - now working on its handle. Will this complete and break up or it will breach down through the channel?   #XLM $XLM #BTX #BNB #STELLAR #Lumens    https://t.co/1qMmgtzv1j   https://t.co/NdHjnvfIwN  https://t.co/Gmnb4ZYnjt,en,[],"['https://twitter.com/HJ_XLM/status/1348055600693989383?s=20', 'https://twitter.com/HJ_XLM/status/1348034421262344195?s=20']",['https://pbs.twimg.com/media/ErVwrUbXEAAUmEx.jpg'],1,0,5,"['xlm', 'xlm', 'btx', 'bnb', 'stellar', 'lumens']",['xlm']
2021-01-09 22:03:10 EST,"one thing is for sure and it's a fact.  No One person in public, has talked about $xlm Stellar Lumens this much.  we all didn't give a shit, always sounded nice. but come on no one saw this.  https://t.co/Md8SyhZTDC",en,[],[],['https://pbs.twimg.com/tweet_video_thumb/ErVslZXXAAMwfM_.jpg'],1,0,5,[],['xlm']
2021-01-09 21:43:33 EST,Almost 69 stellar lumens! I gotta make a song called Stellar Lumens 🎧  https://t.co/UEbKrnLKzc,en,[],[],['https://pbs.twimg.com/media/ErVoGGUXEAEDOzP.jpg'],0,0,1,[],[]
2021-01-09 21:00:09 EST,"Bitcoin SV, Stellar Lumens, FTX Token Price Analysis: 3 November #instaethereum #instavenezuela #SmartCash #fintech #IoT #trading #pow #coinmarketcap  https://t.co/9izK5sEmwb",da,[],['https://livecryptoprices.com.au/en/crypto-news/142917/bitcoin-sv-stellar-lumens-ftx-token-price-analysis-3-november'],[],0,0,0,"['instaethereum', 'instavenezuela', 'smartcash', 'fintech', 'iot', 'trading', 'pow', 'coinmarketcap']",[]
2021-01-09 21:00:09 EST,"Bitcoin SV, Stellar Lumens, FTX Token Price Analysis: 3 November #blockchain #trading #coinbase #trading #coldwallet #zcash #bitcoincash #steem  https://t.co/9izK5sEmwb",da,[],['https://livecryptoprices.com.au/en/crypto-news/142917/bitcoin-sv-stellar-lumens-ftx-token-price-analysis-3-november'],[],0,0,0,"['blockchain', 'trading', 'coinbase', 'trading', 'coldwallet', 'zcash', 'bitcoincash', 'steem']",[]
2021-01-09 19:28:23 EST,Added Stellar Lumens &amp; CELO ... Lets see how these #CryptoCurrencies HIT!,en,[],[],[],0,0,0,['cryptocurrencies'],[]
2021-01-09 19:14:23 EST,Click this link watch some video about the Stellar crypto currency and get free $10 of Stellar Lumens =&gt;  https://t.co/DYQOJVTV3V,en,[],['https://coinbase.com/earn/xlm/invite/7nrf4yq8'],[],0,0,0,[],[]
2021-01-09 18:54:35 EST,"Needed to adjust the channel. The MIDDLE LINE is holding pretty well for now. Channel LOWER LIMIT would act as a stronger resistance. Upon breach down through the channel, it would test &lt;MA&gt;100, &lt;MA&gt;200, then orange channel. #XLM $XLM #STELLAR #Lumens  https://t.co/4CRbYCiTtj",en,[],[],['https://pbs.twimg.com/media/ErVAyLoW8AEuhvu.jpg'],1,0,4,"['xlm', 'stellar', 'lumens']",['xlm']
2021-01-09 18:44:58 EST,"@kingblitzmusic @kingblitzmusic buy XRP, stellar lumens, Bitcoin cash &amp; go heavy in ethereum...don’t listen to help get you started...it’s easy to get taken advantage of and stay out of the stock market...crypto is the future and it makes your money grow 24/7 my guy! Stay up fam! ✊🏽",en,[],[],[],1,0,1,[],[]
2021-01-09 18:40:59 EST,Ho appena imparato di più su Stellar Lumens e in cambio ho guadagnato XLM! Usa il mio invito per iscriverti a Coinbase e guadagnare fino a 40 USD di XLM.  https://t.co/m2D6dBsoA4,it,[],['https://coinbase.com/earn/xlm/invite/snj8dpxm'],[],0,0,0,[],[]
2021-01-09 18:35:55 EST,"2nd most searched crypto (on CMC) in 2021 was Stellar Lumens $XLM Given that $DOGE (most searched) has proclaimed @elonmusk as a their tongue-in-cheek CEO, I wonder if he would ever join a panel with @DenelleDixon to have a more serious discussion around the future of payments?",en,"[{'screen_name': 'elonmusk', 'name': 'elon musk', 'id': '44196397'}, {'screen_name': 'denelledixon', 'name': 'denelle dixon', 'id': '3820356254'}]",[],[],1,0,1,[],"['xlm', 'doge']"
2021-01-09 18:08:37 EST,@BoredElonMusk Do you see Stellar Lumens as the intergalactic currency of the future? #XLM $XLM #Spacemoney #Stellarfamily,en,[],[],[],1,0,0,"['xlm', 'spacemoney', 'stellarfamily']",['xlm']
2021-01-09 17:57:27 EST,@IGFreshgxld @2KIntel @raycondones Nio godly and if xrp beat this case its flyin what about stellar lumens xlm tho ?,en,[],[],[],2,0,0,[],[]
2021-01-09 17:28:37 EST,@lumen_stellar @AdamCross1989 @panosmek I'll pass on the lumens thank you 🤣,en,[],[],[],1,0,0,[],[]
2021-01-09 17:11:39 EST,Bought some more Stellar Lumens. Come on do something crazy 😂 $BTC.X flying again  https://t.co/VIqNURsWl7,en,[],[],['https://pbs.twimg.com/media/ErUp3U_WMAEriJg.jpg'],1,0,7,[],['btc.x']
2021-01-09 16:59:58 EST,Good night stellarbulls! #xlm $xlm #stellarorg #stellarlumens #stellar #lumens #stellarbulls  https://t.co/FwOhQ8Yi9h,en,[],[],['https://pbs.twimg.com/media/ErUnMGSW8AoTNil.jpg'],2,2,18,"['xlm', 'stellarorg', 'stellarlumens', 'stellar', 'lumens', 'stellarbulls']",['xlm']
2021-01-09 16:53:51 EST,"@AssetsDaily It is exciting! I'm not too savvy when it comes to reading charts, however,  I've had this gut feeling about Stellar Lumens for quite some time now!  Even the name implies it's heading for the stars! 🚀🚀",en,[],[],[],0,0,1,[],[]
2021-01-09 16:50:47 EST,"Analyse des prix de Stellar Lumens, Tron, Algorand: 09 janvier -  https://t.co/DrFbZZqsbh",fr,[],['https://www.lacryptomonnaie.net/anglais/analyse-des-prix-de-stellar-lumens-tron-algorand-09-janvier-2/'],[],0,0,0,[],[]
2021-01-09 16:33:17 EST,Just learned about Stellar Lumens and earned XLM in return! Use my invite to join Coinbase and earn up to $50 of XLM.  https://t.co/n53kmJQU4P,en,[],['https://coinbase.com/earn/xlm/invite/09328v4w'],[],0,0,0,[],[]
2021-01-09 16:32:54 EST,looking in my mail every day for that @terniotoken blockcard visa debit card powered with $xlm Stellar Lumens like.. #xlm holds like 10 different cryptos?  https://t.co/CYNmlA29E5  https://t.co/7KaFTavCgD,en,"[{'screen_name': 'terniotoken', 'name': 'ternio 💳 🏦', 'id': '945778840642527232'}]",['https://dashboard.getblockcard.com/i/ACuhCC9g'],['https://pbs.twimg.com/tweet_video_thumb/ErUg_hxXIAIltji.jpg'],2,1,5,['xlm'],['xlm']
2021-01-09 16:31:24 EST,This is for anyone on Coinbase looking for an invite to the Stellar Lumens #xlm earn reward.  #coinbase #coinbaseearn  Just learned about Stellar and earned $XLM in return! Use my invite to join Coinbase and earn up to $50 of $XLM.  https://t.co/mWdXJDiBTl,en,[],['https://coinbase.com/earn/xlm/invite/9gnkvz5s'],[],2,0,0,"['xlm', 'coinbase', 'coinbaseearn']","['xlm', 'xlm']"
2021-01-09 16:24:46 EST,@Benzinga $XLM STELLAR LUMENS,in,[],[],[],0,0,2,[],['xlm']
2021-01-09 15:35:57 EST,Cowrie opens Stellar Lumens (XLM) powered payment corridor for Nigeria!    https://t.co/qWRhhRNEjH,en,[],['https://www.crypto-news-flash.com/cowrie-opens-stellar-lumens-xlm-powered-payment-corridor-for-nigeria/'],[],0,1,3,[],[]
2021-01-09 15:02:22 EST,"@elonmusk Get on to Stellar Lumens, the intergalactic currency standard. $xlm #xlm #spacemoney #StellarLumens #iwantaroadster",en,[],[],[],0,3,4,"['xlm', 'spacemoney', 'stellarlumens', 'iwantaroadster']",['xlm']
2021-01-09 14:56:19 EST,"Yep stellar lumens time , it is loading... #XLM #StellarLumens",en,[],[],[],0,0,2,"['xlm', 'stellarlumens']",[]
2021-01-09 14:49:40 EST,"#crypto #BTCUSD Stellar Lumens, Tron, Algorand Price Analysis: 09 January #btcnews #btc #bnb via  https://t.co/tLfbYLqB49",en,[],['http://www.ohnocrypto.com/2021/01/stellar-lumens-tron-algorand-price.html'],[],0,0,0,"['crypto', 'btcusd', 'btcnews', 'btc', 'bnb']",[]
2021-01-09 14:33:18 EST,"Stellar Lumens, Tron, Algorand Price Analysis: 09 January  https://t.co/TK7arClGTK  https://t.co/hEqK5KwGUK",en,[],['https://zephyrnet.com/stellar-lumens-tron-algorand-price-analysis-09-january/?utm_source=rss&utm_medium=rss&utm_campaign=stellar-lumens-tron-algorand-price-analysis-09-january'],['https://pbs.twimg.com/media/ErUFnb5U0AEfBFA.png'],0,5,0,[],[]
2021-01-09 14:27:47 EST,"Stellar Lumens, Tron, Algorand Price Analysis: 09 January  https://t.co/4m4xB5Tr2T",en,[],['https://maxbit.cc/stellar-lumens-tron-algorand-price-analysis-09-january/'],[],0,0,0,[],[]
2021-01-09 14:23:11 EST,"Stellar Lumens, Tron, Algorand Price Analysis: 09 January   https://t.co/oAD4jubxzT",en,[],['https://ranz.io/1593'],[],0,0,0,[],[]
2021-01-09 14:15:01 EST,Can I buy a Tesla with Stellar Lumens? @elonmusk,en,"[{'screen_name': 'elonmusk', 'name': 'elon musk', 'id': '44196397'}]",[],[],0,0,0,[],[]
2021-01-09 14:13:09 EST,@swissborg Do you plan to support Stellar Lumens XLM at any point in the future?,en,[],[],[],0,0,0,[],[]
2021-01-09 14:03:47 EST,"Stellar Lumens, Tron, Algorand Price Analysis: 09 January -  https://t.co/t2wtpa0GeW #Crypto #CryptoNews $BTC #ETH #Bitcoin",en,[],['https://hodlersdigest.com/stellar-lumens-tron-algorand-price-analysis-09-january/'],[],0,0,0,"['crypto', 'cryptonews', 'eth', 'bitcoin']",['btc']
2021-01-09 14:00:01 EST,"Stellar Lumens, #Tron, Algorand Price Analysis: 09 January  https://t.co/Tvj07QRXIg",ro,[],['https://ambcrypto.com/stellar-lumens-tron-algorand-price-analysis-09-january/'],[],0,0,0,['tron'],[]
2021-01-09 13:56:22 EST,"Stellar Lumens, Tron, Algorand Price Analysis: 09 January  https://t.co/W1bUcBWiIp",en,[],['https://latestcrypto.news/stellar-lumens-tron-algorand-price-analysis-09-january/'],[],0,0,0,[],[]
2021-01-09 13:51:57 EST,"New post (Stellar Lumens, Tron, Algorand Price Analysis: 09 January) has been published on  https://t.co/4w7A2E5AtV -  https://t.co/mw6YHDGg99  https://t.co/sxTkDoTkYr",en,[],"['http://Fuzzy.One', 'https://www.fuzzy.one/blog/2021/01/10/stellar-lumens-tron-algorand-price-analysis-09-january/']",['https://pbs.twimg.com/media/ErT8KD8VcAACF_x.png'],0,0,0,[],[]
2021-01-09 13:41:07 EST,"Análisis de precios de Stellar Lumens, Tron, Algorand: 09 de enero  https://t.co/f0bVq7NKC7",es,[],['https://es.ambcrypto.com/analisis-de-precios-de-stellar-lumens-tron-algorand-09-de-enero/'],[],0,0,0,[],[]
2021-01-09 13:33:46 EST,"Stellar Lumens, Tron, Algorand Price Analysis: 09 January   https://t.co/BLexrYteCo",en,[],['https://ambcrypto.com/stellar-lumens-tron-algorand-price-analysis-09-january/'],[],0,0,1,[],[]
2021-01-09 13:33:03 EST,"Stellar Lumens, Tron, Algorand Price Analysis: 09 January  https://t.co/2r44kFaZMP #Altcoins #Analysis #HideCryptopanic #News  https://t.co/B6xOClaAFZ",en,[],['https://j.mp/35qdLAw'],['https://pbs.twimg.com/media/ErT31IHVkAM4Zmt.jpg'],0,0,0,"['altcoins', 'analysis', 'hidecryptopanic', 'news']",[]
2021-01-09 12:50:38 EST,Top 7 Best Stellar Lumens (XLM) Wallets 2021 [UPDATED]  https://t.co/OvVm2r4uHP,en,[],['https://ripplecoinnews.com/best-stellar-xlm-wallet/'],[],0,0,1,[],[]
2021-01-09 12:39:55 EST,"I still have faith in XRP, just bought more... can’t wait to go back to work to buy more litecoin, stellar lumens, compound and maker... and a few others! #cryptocurrency",en,[],[],[],0,0,0,['cryptocurrency'],[]
2021-01-09 11:58:45 EST,"NASDAQ, Stellar, WEF, Ripple, XRP, Flare, LTC, Vechain &amp; Pundix NPXS*  https://t.co/dt0KVvAJAS via @YouTube #stellar #lumens #xlm #rippke #xrp #flarenetwork #litecoin #ltc #vechain #vet #pundix #npxs",nl,"[{'screen_name': 'youtube', 'name': 'youtube', 'id': '10228272'}]",['https://youtu.be/NLt9yBeWIJs'],[],5,14,54,"['stellar', 'lumens', 'xlm', 'rippke', 'xrp', 'flarenetwork', 'litecoin', 'ltc', 'vechain', 'vet', 'pundix', 'npxs']",[]
2021-01-09 11:46:32 EST,Stellar Lumens #XLM up 134.54% in the past 7 days $XLM  🔥#StellarLumens🔥  https://t.co/s320350VDU,en,[],[],['https://pbs.twimg.com/media/ErTfc1gXAAUPLqI.jpg'],0,1,2,"['xlm', 'stellarlumens']",['xlm']
2021-01-09 11:45:48 EST,Stellar Lumens XLM Is Going To Make Craziest Move Ever | Here Is The Why...  https://t.co/QZPpX3uKLu via @YouTube #XLM @moon33367268705 @kaboom12344 @WillyWonkaXRP,en,"[{'screen_name': 'youtube', 'name': 'youtube', 'id': '10228272'}, {'screen_name': 'moon33367268705', 'name': 'moon333', 'id': '1157014693321613312'}, {'screen_name': 'kaboom12344', 'name': '🇬🇧 kaboom 🇬🇧', 'id': '1250067621921402880'}, {'screen_name': 'willywonkaxrp', 'name': '🔥bull run wonka🔥 xrp fil 📈', 'id': '1011068228603441152'}]",['https://youtu.be/e1qrgvdopS4'],[],0,0,0,['xlm'],[]
2021-01-09 11:42:55 EST,XLM - Price Prediction 2021 - Stellar Lumens  https://t.co/2XXmRfT1l1 #XLM $XLM #Stellar #StellarLumens #cryptocurrency #cryptocurrencies #bitcoin #BTC $BTC #XRP,en,[],['https://youtu.be/DmEv1-y6mt8'],[],0,0,1,"['xlm', 'stellar', 'stellarlumens', 'cryptocurrency', 'cryptocurrencies', 'bitcoin', 'btc', 'xrp']","['xlm', 'btc']"
2021-01-09 11:32:51 EST,@xrp_hodl_ Same logo as Stellar Lumens 👀👀,en,[],[],[],1,0,2,[],[]
2021-01-09 11:23:03 EST,Stellar Lumens Price was up 10% in the past 24hours . I invested 10 dollars because it’s money that I typically would use to buy liabilities so if it rises or falls another 10% it’s money that I would’ve spent anyway so it’s risk free!!! #StellarLumens #Bitcoin  https://t.co/EuSOQc1NzG,en,[],[],['https://pbs.twimg.com/media/ErTaEwHXMAAO2Ib.jpg'],0,0,0,"['stellarlumens', 'bitcoin']",[]
2021-01-09 11:00:34 EST,Stellar Lumens Fiyat Analizi - Önemli Destek ve Dirençler!  https://t.co/WF02dcU6gm,tr,[],['https://coinotag.com/stellar-lumens-fiyat-analizi-onemli-destek-ve-direncler/'],[],0,0,4,[],[]
2021-01-09 09:20:05 EST,@itsvalvalval Stellar Lumens is great. Has a high ceiling and will be a long term crypto. I also dab in LiteCoin as a good alt coin.,en,[],[],[],0,0,0,[],[]
2021-01-09 09:08:38 EST,"#BTC #DGB #XLM The Crypto Fear and Greed Index registered a value of 90 at press time, with calls for a deeper Bitcoin correction yet to come to the fore. Stellar Lumens ...Read more:  https://t.co/Mucv9xO2XG",en,[],['https://cryptocontrol.io/r/api/article/5fd4ee05b92a44001ad2508f?ref=5c18dd48f5380900192467dd'],[],0,0,0,"['btc', 'dgb', 'xlm']",[]
