created_at,tweet,language,mentions,urls,photos,replies_count,retweets_count,likes_count,hashtags,cashtags
2021-01-18 18:06:59 EST,"@silent_night12 @Davincij15 Kevin O’Leary was describing stellar lumens, not xrp lmao",en,[],[],[],0,0,0,[],[]
2021-01-18 17:44:10 EST,"Stellar Lumens close to breaking out. If/when it does, my next target would be a little over $0.50 #Litecoin #cryptocurrencies  #LINK #GRT #XLM #BTC #LTC #ETH #XRP #Crypto #altcoins  https://t.co/bhsKIJRg4M",en,[],[],['https://pbs.twimg.com/media/EsDHnB3XIAIzRG3.png'],8,7,82,"['litecoin', 'cryptocurrencies', 'link', 'grt', 'xlm', 'btc', 'ltc', 'eth', 'xrp', 'crypto', 'altcoins']",[]
2021-01-18 17:40:41 EST,Stellar Lumens has to break out to the upper side tomorrow.  With all of the good news coming in the last days I am already wondering why it went sideways for a few days..  Get ready for the launch!?  #XLM #stellarlumens #crypto #cryptocurrencies  https://t.co/b2eDrPkZnI,en,[],[],['https://pbs.twimg.com/media/EsDFmMNXEAIpaV6.jpg'],2,4,10,"['xlm', 'stellarlumens', 'crypto', 'cryptocurrencies']",[]
2021-01-18 17:21:04 EST,@Gemini when stellar lumens $XLM? cc @tyler @cameron,en,"[{'screen_name': 'tyler', 'name': 'tyler winklevoss', 'id': '24222556'}, {'screen_name': 'cameron', 'name': 'cameron winklevoss', 'id': '250980843'}]",[],[],0,0,1,[],['xlm']
2021-01-18 17:03:29 EST,Stellar (XLM) &amp; The New World Economic System!!! IMF Urges Governments Worldwide To Spend!!! #Stellar #XLM #Lumen #Lumens #ECB #IMF #cbdc #CBDCs #fintech #blockchain #cryptocurrency #Crypto #CryptoNews #cryptotrading #CryptoTwitter    https://t.co/7VrLFLYHFa,en,[],['https://youtu.be/fiQ0jJLNiPY'],[],0,0,0,"['stellar', 'xlm', 'lumen', 'lumens', 'ecb', 'imf', 'cbdc', 'cbdcs', 'fintech', 'blockchain', 'cryptocurrency', 'crypto', 'cryptonews', 'cryptotrading', 'cryptotwitter']",[]
2021-01-18 16:47:21 EST,@Cointelegraph Stellar Lumens XLM,sv,[],[],[],0,0,0,[],[]
2021-01-18 16:44:27 EST,"Stellar Lumens, Aave, BAT Price Analysis: 18 January   https://t.co/PyzoNNRZDv",da,[],['https://www.ranzware.com/21847'],[],0,0,0,[],[]
2021-01-18 16:14:11 EST,"Stellar Lumens, Aave, BAT Price Analysis: 18 January   https://t.co/dx6GdbM42Z",da,[],['https://ranz.io/1939'],[],0,0,0,[],[]
2021-01-18 16:10:16 EST,"Stellar Lumens and Basic Attention Token were trading right beside their range highs. However, Stellar Lumens struggled to break past the resistance while ...Read more:  https://t.co/YHipXn0PD7",en,[],['https://ambcrypto.com/stellar-lumens-aave-bat-price-analysis-18-january/'],[],0,0,0,[],[]
2021-01-18 16:09:44 EST,Stellar Lumens (XLM) Becoming a Significant Player Considered by Governments and Regulators  https://t.co/GfEJRJycA2 via @@thecurrencyA,en,"[{'screen_name': 'thecurrencya', 'name': 'the currency analytics (#cryptonews)', 'id': '976789086127181824'}]",['https://thecurrencyanalytics.com/23134/stellar-lumens-xlm-becoming-a-significant-player-considered-by-governments-and-regulators/'],[],0,4,3,[],[]
2021-01-18 16:09:40 EST,"Stellar Lumens, Aave, BAT Price Analysis: 18 January -  https://t.co/nYUuPIVNof #Crypto #CryptoNews $BTC #ETH #Bitcoin",en,[],['https://hodlersdigest.com/stellar-lumens-aave-bat-price-analysis-18-january/'],[],0,0,0,"['crypto', 'cryptonews', 'eth', 'bitcoin']",['btc']
2021-01-18 16:00:40 EST,"New post (Stellar Lumens, Aave, BAT Price Analysis: 18 January) has been published on  https://t.co/4w7A2E5AtV -  https://t.co/Yhsm4YMAfZ  https://t.co/qKCX0z4Sjd",en,[],"['http://Fuzzy.One', 'https://www.fuzzy.one/blog/2021/01/19/stellar-lumens-aave-bat-price-analysis-18-january/']",['https://pbs.twimg.com/media/EsCv7ZpUwAIiWvt.png'],0,0,0,[],[]
2021-01-18 16:00:39 EST,Stellar Lumens: FinCEN Regulatory Proposal May Have “Far-Reaching Consequences for #Bitcoin #News  https://t.co/jfbhwFixh6 #blockchainnews,en,[],['https://bitcoinnewspost.com/blockchain-news/stellar-lumens-fincen-regulatory-proposal-may-have-far-reaching-consequences-for-blockchain-and-crypto/?utm_source=ReviveOldPost&utm_medium=social&utm_campaign=ReviveOldPost'],[],0,0,0,"['bitcoin', 'news', 'blockchainnews']",[]
2021-01-18 15:55:31 EST,"Stellar Lumens, Aave, BAT Price Analysis: 18 January  https://t.co/M0N8qUhL4Q",da,[],['https://maxbit.cc/stellar-lumens-aave-bat-price-analysis-18-january/'],[],0,0,0,[],[]
2021-01-18 15:18:20 EST,"Lúmenes estelares y Token de atención básica estaban operando justo al lado de sus máximos de rango. Sin embargo, Stellar Lumens luchó por superar la resistencia, mientras que BAT ya lo hizo, y buscaba aumentar. Aave obtuvo fuertes ganancias durante la s…  https://t.co/G4rSqY05dz",es,[],['https://ift.tt/3swgm65'],[],1,0,0,[],[]
2021-01-18 15:14:47 EST,"#currency #cryptocurrency Stellar Lumens, Aave, BAT Price Analysis: 18 January: HTTP/2 200 date: Mon, 18 Jan 2021 20:05:30 GMT content-type: text/html; charset=UTF-8 set-cookie: __cfduid=dedb04523abadc4b1a00ea45dd20ae4b81611000330;  https://t.co/x3ruHPokQb  https://t.co/g9X0mBRWuY",en,[],['https://tinyurl.com/y2t2gqj6'],['https://pbs.twimg.com/media/EsClbILWMAUeC_b.jpg'],0,0,0,"['currency', 'cryptocurrency']",[]
2021-01-18 15:11:50 EST,"Stellar Lumens, Aave, BAT Price Analysis: 18 January   https://t.co/72snbarTSZ",da,[],['https://ambcrypto.com/stellar-lumens-aave-bat-price-analysis-18-january/'],[],0,0,0,[],[]
2021-01-18 15:11:16 EST,"Stellar Lumens, Aave, BAT Price Analysis: 18 January  https://t.co/BYonbdlcdC",da,[],['https://latestcrypto.news/stellar-lumens-aave-bat-price-analysis-18-january/'],[],0,0,0,[],[]
2021-01-18 15:07:34 EST,"Stellar Lumens, Aave, BAT Price Analysis: 18 January  #blockchain #dlike #cryptocurrency  https://t.co/R8Qw2ALVzr",da,[],['https://dlike.io/latest/news/cryptocurrency/894850/stellar-lumens-aave-bat-price-analysis-18-january'],[],0,0,1,"['blockchain', 'dlike', 'cryptocurrency']",[]
2021-01-18 15:03:05 EST,"Stellar Lumens, Aave, BAT Price Analysis: 18 January  https://t.co/OBfVEh5EWo #Altcoins #Analysis #GlobalNews #HideCryptopanic  https://t.co/TpOmtA4o8y",da,[],['https://j.mp/3sBZ9rT'],['https://pbs.twimg.com/media/EsCivwZVcAANE6m.jpg'],0,0,0,"['altcoins', 'analysis', 'globalnews', 'hidecryptopanic']",[]
2021-01-18 14:34:48 EST,RIPPLE XRP-CONSPIRACY- PIECING TOGETHER THE PUZZLE- STELLAR LUMENS XLM (...  https://t.co/cUI8lryWYw via @YouTube @xxmikecheckxx need more videos on this.  Been a lot of development since lol,en,"[{'screen_name': 'youtube', 'name': 'youtube', 'id': '10228272'}, {'screen_name': 'xxmikecheckxx', 'name': '', 'id': '992301801415192576'}]",['https://youtu.be/SJrv6r19bMs'],[],0,1,2,[],[]
2021-01-18 14:10:53 EST,The Ukraine news increased the value of XLM by $ 0.15. What would a partnership with the Federal Reserve do to the price of STELLAR? #xlm $xlm #stellarorg #stellarlumens #stellar #lumens,en,[],[],[],5,7,41,"['xlm', 'stellarorg', 'stellarlumens', 'stellar', 'lumens']",['xlm']
2021-01-18 14:01:02 EST,keeping a sharp eye on stellar lumens AKA XLM things could get spicy soon copped some and im watching it like a hawk  dm for crypto course #investment #XLM #bitcoinnews #money  https://t.co/ZcvV8hibKQ,en,[],[],['https://pbs.twimg.com/media/EsCUF4bXMAYKTaY.png'],0,0,0,"['investment', 'xlm', 'bitcoinnews', 'money']",[]
2021-01-18 12:39:54 EST,Put my trust in XRP &amp; Stellar Lumens 🤞🏾,en,[],[],[],0,0,0,[],[]
2021-01-18 12:07:26 EST,"There are a number of common cryptocurrencies, some that you’ve probably heard of and others you may know nothing about. They include Bitcoin, Ethereum, Litecoin, Stellar Lumens, SureRemit, Dash.  https://t.co/nYLvDZJoxg",en,[],[],['https://pbs.twimg.com/media/EsB6iUgXIBsiIdm.jpg'],1,1,5,[],[]
2021-01-18 10:00:24 EST,XRP Ripple Holders CHECK THIS OUT BEFORE ITS TOO LATE! Stellar Lumens Is Moments Away From Exploding   https://t.co/fFrIn6Fvvt,en,[],['http://zpr.io/HQ7cS'],[],2,3,5,[],[]
2021-01-18 09:35:47 EST,@DarkCryptoLord Bruh...how you gonna act like buying $70k of stellar fucking lumens isn't destructive as hell?  I'd rather have OTM $TSLA puts.,en,[],[],[],0,0,0,[],['tsla']
2021-01-18 08:49:27 EST,"#TIX #XLM #CAG #MGO Stellar Lumens (XLM) has been cooling over the past two sessions, potentially making room for another run higher. XLM/USD bulls did force a breakout and no...Read more:  https://t.co/pgVaD3JuKr",en,[],['https://cryptocontrol.io/r/api/article/5c23c296bd6ed8001b5a286b?ref=5c18dd48f5380900192467dd'],[],0,0,0,"['tix', 'xlm', 'cag', 'mgo']",[]
2021-01-18 08:24:16 EST,"@LeoDpsGG Salut, est-ce que tu peux faire une vidéo sur le Stellar Lumens ? Merci",fr,[],[],[],0,0,0,[],[]
2021-01-18 08:20:51 EST,Stellar Lumens XLM News: Momentum In 2021  https://t.co/zv9W0JKJOf via @YouTube,en,"[{'screen_name': 'youtube', 'name': 'youtube', 'id': '10228272'}]",['https://youtu.be/trpRCzDOZjw'],[],0,0,0,[],[]
2021-01-18 07:16:04 EST,$0.40 by EOD! 💥🚀 #xlm $xlm #stellarorg #stellarlumens #stellar #lumens,pl,[],[],[],5,4,34,"['xlm', 'stellarorg', 'stellarlumens', 'stellar', 'lumens']",['xlm']
2021-01-18 07:03:53 EST,"Aset #crypto #Stellar Lumens ( $XLM ) mengalami ledakan harga fantastis dalam setahun terakhir. Apabila diakumulasi secara tahunan (yoy), persentase kenaikannya lebih dari 600%.   https://t.co/XH92Xkx9sI",in,[],['https://jelajahcoin.com/news/harga-xlm-meledak-dengan-kenaikan-lebih-dari-600/'],[],0,1,2,"['crypto', 'stellar']",['xlm']
2021-01-18 06:41:11 EST,Stellar Lumens 😍❤️,sv,[],[],[],0,0,1,[],[]
2021-01-18 06:37:24 EST,@BundleAfrica stellar lumens  the Graph,en,[],[],[],0,0,3,[],[]
2021-01-18 06:08:38 EST,"In this article, we will show you how to earn free #Stellar Lumens (XLM) while #learning about #cryptocurrency on the #Coinbase platform.  https://t.co/9Hilvl2RPv",en,[],['https://eacryptotrading.com/earn-crypto-while-learning/'],[],0,0,0,"['stellar', 'learning', 'cryptocurrency', 'coinbase']",[]
2021-01-18 06:02:04 EST,Harga aset kripto atau cryptocurrency Stellar Lumens (XLM) terus mengalami penguatan dalam kurun waktu setahun terakhir.  https://t.co/DpiUmIdgBs,in,[],['http://dlvr.it/Rqpdr1'],[],0,1,1,[],[]
2021-01-18 05:25:31 EST,"Stellar lumens el futuro de las criptomonedas. Si quieres invertir poco y ganar a largo plazo, pa' lante",es,[],[],[],1,0,1,[],[]
2021-01-18 03:29:32 EST,"Mata uang virtual Stellar Lumens (XLM) mengalami lonjakan harga dalam setahun terakhir. Apabila diakumulasi secara tahunan (yoy), persentase kenaikannya lebih dari 600 persen. Tak kalah dari Bitcoin.  https://t.co/QdEUVFnB4O",in,[],['https://kumparan.com/kumparanbisnis/tak-kalah-dari-bitcoin-nilai-mata-uang-virtual-ini-melonjak-600-persen-1v0CeBrXeST?utm_medium=post&utm_source=Twitter&utm_campaign=int'],[],0,2,7,[],[]
2021-01-18 03:21:53 EST,"@RsSwiss @ImMatthew_Davis @JedMcCaleb @StellarOrg I don’t know what kind of life you’ve been living to be butthurt over Stellar’s massive gains. Pay attention to the low’s, not the high’s, because that’s when you buy.  #XLM #Lumens  https://t.co/XbdvLMXGaC",en,[],[],['https://pbs.twimg.com/tweet_video_thumb/EsACP6dXMAAoimo.jpg'],1,3,20,"['xlm', 'lumens']",[]
2021-01-18 02:42:07 EST,@tosunziya112 Günaydın..  Bitcoin Ethereum IOTA DigiByte Zcash Stellar Lumens Ziliqa Nano  Aklıma gelenler.. Yani diğerlerini beğenmiyorum değil aklıma gelen beğendiklerim bunlar. :),tr,[],[],[],0,0,10,[],[]
2021-01-18 02:24:28 EST,STELLAR JUST HODL. #xlm $xlm #stellarorg #stellarlumens #stellar #lumens  https://t.co/hHCoSnNVrK,en,[],[],['https://pbs.twimg.com/media/Er_1HFTXYAQPPK6.jpg'],2,21,76,"['xlm', 'stellarorg', 'stellarlumens', 'stellar', 'lumens']",['xlm']
2021-01-17 23:08:01 EST,Stellar Lumens (XLM) Becoming a Significant Player Considered by Governments and Regulators  https://t.co/iOquJTNaFZ,en,[],['https://thecurrencyanalytics.com/23134/stellar-lumens-xlm-becoming-a-significant-player-considered-by-governments-and-regulators/'],[],0,0,0,[],[]
2021-01-17 21:23:45 EST,"@IamPapiCrypto @justinsuntron ok, can you check cardano(ADA) and stellar lumens (XLM) prices only ... go compare their price against tron before and after market bullrun and you will understand what i mean dude",en,[],[],[],1,0,0,[],[]
2021-01-17 20:47:28 EST,Stellar Lumens (XLM) Analysis  🌼 Curated post from Publish0x ⚡ Awesome $BAT and $ETH faucet #ad  https://t.co/LXZk6Ntbjl,en,[],['https://www.publish0x.com/cryptocurrencies-analyst/stellar-lumens-xlm-analysis-xgpjnzn?a=nXe0rZVbxr&tid=curated'],[],0,0,1,['ad'],"['bat', 'eth']"
2021-01-17 20:42:53 EST,might want to add #XLM to your bag @.30  XLM just got accepted in another country. It's inevitable it will take off.  There's my shill bag advice today.    Buy Stellar Lumens= xlm =stack = thank me later.   You can buy me lunch. 🧏‍♀️ Don't forget buy #Bitcoin &amp; #Ethereum  ✍🏪 ~ t,en,[],[],[],0,1,3,"['xlm', 'bitcoin', 'ethereum']",[]
2021-01-17 20:36:43 EST,Coinbase | Earn Stellar Lumens  https://t.co/m6sxqiQbc5,en,[],['https://www.coinbase.com/earn/stellar/lesson/6'],[],0,0,0,[],[]
2021-01-17 20:16:58 EST,Okay I figured out what was making me monies. It’s my chainlink &amp; stellar lumens.,en,[],[],[],0,0,1,[],[]
2021-01-17 19:52:41 EST,Gagner 50$ de Cryptomonnaie Stellar Lumens #gratuit via mon lien de #parrainage Coinbase ci-dessous :)   https://t.co/Jm6pweIli6,fr,[],['https://coinbase.com/earn/xlm/invite/g0tf896z'],[],0,0,0,"['gratuit', 'parrainage']",[]
2021-01-17 19:40:12 EST,#Stellar $XLM Stellar Lumens (XLM) Becoming a Significant Player Considered by Governments and Regulators  https://t.co/TNpi0xpUv1 via @@thecurrencyA,en,"[{'screen_name': 'thecurrencya', 'name': 'the currency analytics (#cryptonews)', 'id': '976789086127181824'}]",['https://thecurrencyanalytics.com/23134/stellar-lumens-xlm-becoming-a-significant-player-considered-by-governments-and-regulators/'],[],0,9,17,['stellar'],['xlm']
2021-01-17 19:27:36 EST,“#Stellar #Lumens (#XLM) Becoming a Significant Player Considered by Governments and Regulators” #XLM @StellarOrg #StellarGlobal #StellarFamily  https://t.co/uzPBlgitm3,en,"[{'screen_name': 'stellarorg', 'name': 'stellar', 'id': '2460502890'}]",['https://thecurrencyanalytics.com/23134/stellar-lumens-xlm-becoming-a-significant-player-considered-by-governments-and-regulators/'],[],1,49,131,"['stellar', 'lumens', 'xlm', 'xlm', 'stellarglobal', 'stellarfamily']",[]
2021-01-17 19:24:16 EST,Just bought some Stellar Lumens good idea ?,en,[],[],[],0,0,0,[],[]
2021-01-17 19:18:18 EST,"So if making a SWING Trade that pays 95% from 31 Sats(60 cents Target).   50% from the recent High of 40 cents.     Then $XLM is for you!!  STELLAR LUMENS is Royalty, &amp; has the partnerships(current), &amp; future partnerships to show for it.  HOPE for $BTC dip/Lower $XLM USD pricing.",en,[],[],[],0,0,2,[],"['xlm', 'btc', 'xlm']"
2021-01-17 18:34:15 EST,@cryptoprojects2 @PiffBlowington @bashycrypto Describe what you think stellar lumens is,en,[],[],[],1,0,0,[],[]
2021-01-17 18:32:20 EST,@GeminiSupport Add XLM stellar lumens,en,[],[],[],0,0,0,[],[]
2021-01-17 17:41:51 EST,@TrustWalletApp Yes but your looking at a 3 year hold. Buy Stellar Lumens for a faster growth.  (Not financial advice),en,[],[],[],1,0,2,[],[]
2021-01-17 17:31:14 EST,Goodnight. 😴 #xlm #xrp  $xlm $xrp #stellarorg #ripple #stellarlumens #stellar #lumens  https://t.co/ICRDTTgi2c,en,[],[],['https://pbs.twimg.com/media/Er97ENVW8AwxYVC.jpg'],0,3,19,"['xlm', 'xrp', 'stellarorg', 'ripple', 'stellarlumens', 'stellar', 'lumens']","['xlm', 'xrp']"
2021-01-17 16:52:46 EST,Dolanan o stellar lumens wae Chep tipis tipis mah genah,in,[],[],[],0,0,0,[],[]
2021-01-17 16:24:05 EST,コニベットカジノ🔥 取扱No.1🔥仮想通貨  ビットコイン（Bitcoin） ビットコインキャッシュ（BitcoinCASH） ライトコイン（Litecoin） イーサリアム（Ethereum） リップル（Ripple） ステラルーメン（Stellar Lumens） ジーキャッシュ（Zcash） ダッシュ（Dash〕 #オンカジ   https://t.co/mWeKtEXFnp  https://t.co/BdoCYE3Mnr,ja,[],['https://tracker-pm2.konibet.com/link?btag=5887369_112942'],['https://pbs.twimg.com/media/Er9rsbXUwAEz_n4.jpg'],0,0,1,['オンカジ'],[]
2021-01-17 15:49:06 EST,@KEEMSTAR @MoonLamboio Would much rather it be lumens going to $2. Check them out @KEEMSTAR . Stellar Lumens,en,"[{'screen_name': 'keemstar', 'name': 'keem 🍿', 'id': '872683897'}]",[],[],0,0,0,[],[]
2021-01-17 15:41:18 EST,@bullishdog @JapanPapi Lol let’s redo and repost bro. That NDRC is stellar lol no lumens,en,[],[],[],1,0,3,[],[]
2021-01-17 15:35:48 EST,Crypto Is Freedom!  #Crypto #blockchain #Inflation #cryptotrading #CryptoTwitter #Stellar #Lumens #XLM #Ripple #XRP #ETH #DeFi #fintech #CBDC #CBDC #cryptocurrency   https://t.co/eXWuPkbWhy,en,[],['https://youtu.be/7wYwIws3SKc'],[],0,0,1,"['crypto', 'blockchain', 'inflation', 'cryptotrading', 'cryptotwitter', 'stellar', 'lumens', 'xlm', 'ripple', 'xrp', 'eth', 'defi', 'fintech', 'cbdc', 'cbdc', 'cryptocurrency']",[]
2021-01-17 15:19:16 EST,Stellar Lumens (XLM) Becoming a Significant Player Considered by Governments and Regulators  https://t.co/Uz4sk43OVd,en,[],['https://thecurrencyanalytics.com/23134/stellar-lumens-xlm-becoming-a-significant-player-considered-by-governments-and-regulators/?utm_source=rss&utm_medium=rss&utm_campaign=stellar-lumens-xlm-becoming-a-significant-player-considered-by-governments-and-regulators'],[],0,0,0,[],[]
2021-01-17 15:11:11 EST,"@CryptoFinally Chainlink, Stellar Lumens, Cosmo",en,[],[],[],0,0,1,[],[]
2021-01-17 13:43:36 EST,@criscyborg Coinbase is great for crypto. Also get stellar lumens!! It went up from 0.15 cents to around 0.30 cents recently.,en,[],[],[],0,0,0,[],[]
2021-01-17 13:27:13 EST,Should we make a post about Stellar Lumens?,en,[],[],[],0,0,1,[],[]
2021-01-17 13:09:01 EST,@elonmusk use Stellar Lumens 🧏🏽‍♂️,en,[],[],[],0,0,1,[],[]
2021-01-17 12:04:43 EST,@BobMcPharly @LynAldenContact What's your opinion of XLM (Stellar Lumens)? Getting a little attraction in a couple countries recently.,en,[],[],[],1,0,1,[],[]
2021-01-17 12:00:32 EST,$1 is in the play for stellar Lumens!! $XLM  $BTC $ETH $DOT $LINK $XRP $ADA  https://t.co/a4QD2Jt25O,en,[],[],['https://pbs.twimg.com/media/Er8vVUGXAAEcsOr.jpg'],1,0,5,[],"['xlm', 'btc', 'eth', 'dot', 'link', 'xrp', 'ada']"
2021-01-17 11:58:31 EST,Bitcoin's market cap is exactly 100 times bigger than stellar's. #btc marketcap 670 B and #stellar 6.7 B. Room to grow I would say. 💥🚀 #xlm $xlm #stellarorg #stellarlumens #stellar #lumens,en,[],[],[],1,3,24,"['btc', 'stellar', 'xlm', 'stellarorg', 'stellarlumens', 'stellar', 'lumens']",['xlm']
2021-01-17 11:56:41 EST,Stellar Lumens update #cryptocurrencies  #LINK #GRT #XLM #BTC #LTC #ETH #XRP #Crypto #altcoins  https://t.co/gxLW6RmZmY,en,[],[],['https://pbs.twimg.com/media/Er8ueqPXIAE2SKc.png'],8,6,47,"['cryptocurrencies', 'link', 'grt', 'xlm', 'btc', 'ltc', 'eth', 'xrp', 'crypto', 'altcoins']",[]
2021-01-17 11:25:29 EST,@nonumedel_ @arielsbdar Stellar Lumens? Juguete pero pinta bien,es,[],[],[],0,0,0,[],[]
2021-01-17 10:58:45 EST,"@WasPraxis @Plinz I made Bitcoins from other ways, not just dollars.  I made Bitcoin by doing non-profit work that folks donated Bitcoin for, and I made Bitcoin with Stellar Lumens (given to me for free) and Bitcoin forks.",en,[],[],[],0,0,0,[],[]
2021-01-17 10:26:06 EST,🧑‍🚀🔥🚀Stellar Lumens daily volume was less than $200 million a day mid November. Now it's over $1 Billion a day. What's going on? #GOLD #DYOR #BTSE $NEXO #Dai #Bitcoin #BTC #Ethereum #ETH #XLM #StellarLumens #xrp #LitecoinFam #ZRX #Zcash #alts #Crypto #cryptocurrencies #btclife,en,[],[],[],0,4,4,"['gold', 'dyor', 'btse', 'dai', 'bitcoin', 'btc', 'ethereum', 'eth', 'xlm', 'stellarlumens', 'xrp', 'litecoinfam', 'zrx', 'zcash', 'alts', 'crypto', 'cryptocurrencies', 'btclife']",['nexo']
2021-01-17 09:57:37 EST,Some see this as just information. I see this as great news for stellar and the value of stellar for 2021! 💥🚀 #xlm $xlm #stellarorg #stellarlumens #stellar #lumens #stellarbull  https://t.co/nVqCpYD9l7,en,[],[],['https://pbs.twimg.com/media/Er8TPRxXEAECYFv.jpg'],1,6,28,"['xlm', 'stellarorg', 'stellarlumens', 'stellar', 'lumens', 'stellarbull']",['xlm']
2021-01-17 09:56:45 EST,also shown in the commercial was an item that looked like the symbol for Stellar Lumens $XLM  https://t.co/RD05YFi6nZ,en,[],[],['https://pbs.twimg.com/media/Er8SxYCW8AIBSoa.jpg'],0,0,4,[],['xlm']
2021-01-17 09:12:32 EST,🌟Stellar Lumens (XLM) Becoming a Significant Player Considered by Governments and Regulators - The Currency Analytics via BTCnews on iOS #cryptoviewing #remoteviewing #bitcoin #Ethereum #DigiByte #cryptocurrency #blockchain #DeFi #Litecoin #XLM #Chainlink  https://t.co/Furg4Z9mC7,en,[],['https://thecurrencyanalytics.com/23134/stellar-lumens-xlm-becoming-a-significant-player-considered-by-governments-and-regulators/?utm_source=rss&utm_medium=rss&utm_campaign=stellar-lumens-xlm-becoming-a-significant-player-considered-by-governments-and-regulators'],[],1,21,56,"['cryptoviewing', 'remoteviewing', 'bitcoin', 'ethereum', 'digibyte', 'cryptocurrency', 'blockchain', 'defi', 'litecoin', 'xlm', 'chainlink']",[]
2021-01-17 07:58:25 EST,@imBagsy #XLM  is in top 10 since Nov 2020.. just saying.   Stellar Lumens XLM,en,[],[],[],0,0,2,['xlm'],[]
2021-01-17 07:56:15 EST,Stellar Lumens (XLM) Becoming a Significant Player Considered by Governments and Regulators  https://t.co/L9nf9jQcrt,en,[],['https://thecurrencyanalytics.com/23134/stellar-lumens-xlm-becoming-a-significant-player-considered-by-governments-and-regulators/'],[],0,1,2,[],[]
2021-01-17 06:59:04 EST,Stellar Lumens (XLM) Becoming a Significant Player Considered by Governments and Regulators  https://t.co/favrB39AcK via @@thecurrencyA,en,"[{'screen_name': 'thecurrencya', 'name': 'the currency analytics (#cryptonews)', 'id': '976789086127181824'}]",['https://thecurrencyanalytics.com/23134/stellar-lumens-xlm-becoming-a-significant-player-considered-by-governments-and-regulators/'],[],0,0,1,[],[]
2021-01-17 06:33:32 EST,Stellar Lumens (XLM) Becoming a Significant Player Considered by Governments and Regulators   https://t.co/iNDOkCK39t,en,[],['https://thecurrencyanalytics.com/23134/stellar-lumens-xlm-becoming-a-significant-player-considered-by-governments-and-regulators/?utm_source=rss&utm_medium=rss&utm_campaign=stellar-lumens-xlm-becoming-a-significant-player-considered-by-governments-and-regulators'],[],0,3,6,[],[]
2021-01-17 06:28:19 EST,📣 Stellar Lumens (XLM) Becoming a Significant Player Considered by Governments and Regulators   🔗:  https://t.co/wHns2jpUI9   #⃣: #cryptonews #stellarLumens #XLM #Stellar #Governments #Regulators #SDF  🟢 : @Stellarorg  https://t.co/dIdn4owTEj,en,"[{'screen_name': 'stellarorg', 'name': 'stellar', 'id': '2460502890'}]",['https://thecurrencyanalytics.com/23134/stellar-lumens-xlm-becoming-a-significant-player-considered-by-governments-and-regulators/?utm_campaign=twitter&utm_medium=twitter&utm_source=twitter'],['https://pbs.twimg.com/media/Er7jVhkW8AAXH-L.jpg'],0,3,9,"['cryptonews', 'stellarlumens', 'xlm', 'stellar', 'governments', 'regulators', 'sdf']",[]
2021-01-17 05:43:52 EST,Not my chart but I like it!  mission control we have liftoff - #XLMUSD TradingView  https://t.co/gnkBmWBLqa   #XLM #Stellar #Lumens #Crypto #BTC #Bitcoin,en,[],['https://www.tradingview.com/chart/XLMUSD/Xb540N9V-54321-mission-control-we-have-liftoff/'],[],0,0,1,"['xlmusd', 'xlm', 'stellar', 'lumens', 'crypto', 'btc', 'bitcoin']",[]
2021-01-17 05:37:38 EST,"@freds4hb I know my friend did it and I literally watched the currency go into his coinbase account so it all seems fine, but he'd be hoping that Stellar Lumens value skyrockets like Bitcoins did.",en,[],[],[],0,0,1,[],[]
2021-01-17 05:31:34 EST,@elonmusk Thoughts on Stellar Lumens XLM?,en,[],[],[],0,0,3,[],[]
2021-01-17 05:06:07 EST,"$XLM Stellar Lumens (XLM) Fiyat Tahmini (Prediction) 2021, 2025, 2030  #XLM #Stellar #tahmin   https://t.co/aK0GvqCucy",in,[],['https://www.onlinekredi.com/stellar-lumens-xlm-fiyat-tahmini-2020-2021-2025-2030/'],[],0,0,0,"['xlm', 'stellar', 'tahmin']",['xlm']
2021-01-17 05:05:30 EST,"$XLM Stellar Lumens (XLM) Price Prediction (Prediction) 2021, 2025, 2030  #XLM #Stellar #prediction   https://t.co/eZ1cijFrls",fr,[],['https://www.onlinekredi.com/stellar-lumens-xlm-price-prediction-prediction-2021-2025-2030/'],[],1,0,0,"['xlm', 'stellar', 'prediction']",['xlm']
2021-01-17 02:32:52 EST,コニベットカジノ🔥 取扱No.1🔥仮想通貨  ビットコイン（Bitcoin） ビットコインキャッシュ（BitcoinCASH） ライトコイン（Litecoin） イーサリアム（Ethereum） リップル（Ripple） ステラルーメン（Stellar Lumens） ジーキャッシュ（Zcash） ダッシュ（Dash〕 鬼熱登録🔥  https://t.co/os5G1Q1ghD  https://t.co/JkIhAm87Pc,ja,[],['https://tracker-pm2.konibet.com/link?btag=5887369_112943'],['https://pbs.twimg.com/media/Er6tcYWVEAM97xS.jpg'],0,0,0,[],[]
2021-01-17 02:23:30 EST,Digital Euro uses Stella Lumens technology. Please prepare for the sudden rise in the price when it is actually adopted. #ステラルーメン #リップル  #XRP #Stellar #XLM #Ethereum #BTC  #Bitcoin,en,[],[],[],0,1,1,"['ステラルーメン', 'リップル', 'xrp', 'stellar', 'xlm', 'ethereum', 'btc', 'bitcoin']",[]
2021-01-17 01:51:03 EST,@Rhett_Creighton 25% Chainlink 25% Stellar Lumens 25% Ravencoin 25% Nano,en,[],[],[],0,0,0,[],[]
2021-01-17 00:24:13 EST,"If you're 90 years old and want to triple your estate for your next of kin, buying stellar lumens at $0.30 and selling at $1 is the most risk averse way to do it",en,[],[],[],0,0,1,[],[]
2021-01-17 00:06:21 EST,"Stellar (XLM) Analysis: Stellar Lumens Consolidates At $0.29 From Longer Period Of Time  https://t.co/PBymcj0nvN #investing,cryptocurrency #trading #investing",en,[],['https://themarketperiodical.com/2021/01/16/stellar-xlm-analysis-stellar-lumens-consolidates-at-0-29-from-longer-period-of-time'],[],0,2,2,"['investing', 'trading', 'investing']",[]
