created_at,tweet,language,mentions,urls,photos,replies_count,retweets_count,likes_count,hashtags,cashtags
2021-01-06 10:30:52 EST,Stellar Lumens: le SDF choisi par le gouvernement ukrainien pour développer la CBDC  L'Ukraine a signé un accord avec la #Stellar #Lumens Development Foundation pour créer une monnaie numérique de banqu  https://t.co/NFSxogbpTl  https://t.co/9Z22KaRoQC,fr,[],['https://www.hebergementwebs.com/blockchain/stellar-lumens-le-sdf-choisi-par-le-gouvernement-ukrainien-pour-developper-la-cbdc'],['https://pbs.twimg.com/media/ErDxXMnXMAEpakO.jpg'],0,0,0,"['stellar', 'lumens']",[]
2021-01-06 10:15:39 EST,Look At Parabolic Bull Run Of Stellar Lumens XLM | It Is Going To Break ...  https://t.co/1uiTxdOQDA via @YouTube,en,"[{'screen_name': 'youtube', 'name': 'youtube', 'id': '10228272'}]",['https://youtu.be/gb9_MriAssA'],[],0,0,0,[],[]
2021-01-06 10:13:56 EST,Better hurry up and buy Stellar Lumens #XLM  #Bitcoin #XRP #BTC #crypto #cryptocurrency #cvc #dnt #lrc #ETH,en,[],[],[],1,0,3,"['xlm', 'bitcoin', 'xrp', 'btc', 'crypto', 'cryptocurrency', 'cvc', 'dnt', 'lrc', 'eth']",[]
2021-01-06 10:06:45 EST,Ethereum：35.3％ NEM：18.3％ Ripple：13.4％ Stellar Lumens：13.0％ Bitcoin Cash：10.4％ Litecoin：3.8％ Bitcoin：2.3％ Qtum：2.0％ IOStoken：1.0％ #コインマネージ,en,[],[],[],0,0,1,['コインマネージ'],[]
2021-01-06 10:06:22 EST,"Incidentally, I'm still excited about sparking of Stellar Lumens... I can not sleep.",en,[],[],[],0,0,0,[],[]
2021-01-06 10:05:05 EST,I need stellar lumens to hit,en,[],[],[],0,0,0,[],[]
2021-01-06 09:58:58 EST,Today is Stellar Lumens (XLM) turn to moon. — Blurt  https://t.co/eg9sHZjjqo,en,[],['https://blurt.blog/stellar/@offgridlife/today-is-stellar-lumens-xlm-turn-to-moon'],[],0,0,3,[],[]
2021-01-06 09:54:39 EST,Fuck it just made some money with the quick pump xrp got and dumped it back into stellar lumens as Stellar lumens is at a low. Unsure what to do with xrp still!?!?,en,[],[],[],0,0,0,[],[]
2021-01-06 09:47:40 EST,"Actually.. Make that 10😜🤣🤣 RT @Lu1sLuciano: Yo me levante contento por que hice $100 dólares durmiendo con criptomonedas de Bitcoin, Stellar Lumens y The Graph. Coño como se sentirán los ricos cuando le entran eso cheque de 10 o 100 mil dólares 😂😂😂😂",es,"[{'screen_name': 'lu1sluciano', 'name': 'luis vazquez', 'id': '75068833'}]",[],[],1,0,0,[],[]
2021-01-06 09:38:27 EST,"@mrfrenchtoast They have already officially rejected this notion in their summary. XLM is not going to be used, at all. It's a private permissioned DLT based on Hyperledger. At no point did SDF say anything about Stellar Lumens in the proposal.",en,[],[],[],0,0,3,[],[]
2021-01-06 09:36:34 EST,Buy Stellar Lumens ..,en,[],[],[],0,0,0,[],[]
2021-01-06 09:31:37 EST,@Raye_2Necklaces Word u hip to Stellar Lumens?,en,[],[],[],1,0,0,[],[]
2021-01-06 09:28:30 EST,My referral link to earn $10 of Stellar Lumen  https://t.co/qkDhPqjUjz  #Stellar #StellarLumens #Crypto #XLM #Bitcoin,en,[],['https://coinbase.com/earn/xlm/invite/9hz3m1rt'],[],0,1,3,"['stellar', 'stellarlumens', 'crypto', 'xlm', 'bitcoin']",[]
2021-01-06 09:23:34 EST,"Sold my xlm (Stellar Lumens) today to take some profit. Converted it over to xrp. Would like to see xrp under $0.20 for much more buying, but don't think it will drop again below that mark. @pulte",en,"[{'screen_name': 'pulte', 'name': 'pulte', 'id': '25029495'}]",[],[],0,0,0,[],[]
2021-01-06 09:21:22 EST,"Bardeé a Stellar Lumens y clavó +30%, síganme para más bardeos",es,[],[],[],0,0,2,[],[]
2021-01-06 09:20:08 EST,Stellar lumens making some MAD GAINS #crypto #xlm #ada,en,[],[],[],0,0,0,"['crypto', 'xlm', 'ada']",[]
2021-01-06 09:15:21 EST,@Beincrypto_DE Stellar Lumens,sv,[],[],[],0,0,1,[],[]
2021-01-06 09:09:41 EST,Holy stellar lumens,en,[],[],[],0,0,0,[],[]
2021-01-06 09:09:36 EST,$XLM.X $XLM #Lumens Up 60% today... Money moving out of $XRP it seems,en,[],[],[],0,0,0,['lumens'],"['xlm.x', 'xlm', 'xrp']"
2021-01-06 09:09:18 EST,Win Free Stellar Lumens #xlm $50 waiting for you in the link below:   https://t.co/DkWXB9X2F4,en,[],['https://coinbase.com/earn/xlm/invite/rbncv62p'],[],0,1,0,['xlm'],[]
2021-01-06 09:02:36 EST,someone do this pls i love stellar lumens and want more money $XLM.  https://t.co/ne7pQQmUVm,en,[],['https://coinbase.com/earn/xlm/invite/cjs17prf'],[],0,0,0,[],['xlm']
2021-01-06 08:56:44 EST,Stellar Lumens price rn tho  👀👀👀👀👀👀👀👀👀👀👀,en,[],[],[],0,0,0,[],[]
2021-01-06 08:55:02 EST,XLM Price Surges as Ukraine Selects Stellar Lumens for CBDC Development  https://t.co/XN3C3lOhvA,en,[],['http://dlvr.it/Rq1Z4N'],[],0,0,1,[],[]
2021-01-06 08:52:42 EST,It’s fun advising someone to invest in your picks and then actually seeing seeing it moon a few days later lol   Stellar Lumens ladies and gents   https://t.co/sbHRJiLQDn,en,[],[],['https://pbs.twimg.com/media/ErDa5MWW8AAesPw.jpg'],0,0,2,[],[]
2021-01-06 08:52:34 EST,Held stellar lumens over night and almost didn’t go to work today 🤩😂😂😂😂,en,[],[],[],0,0,1,[],[]
2021-01-06 08:46:26 EST,141% on stellar lumens  this week! Big cash out!,en,[],[],[],0,0,2,[],[]
2021-01-06 08:32:50 EST,A little bit of a pull back. @JedMcCaleb is selling 😝 Then straight to $ 0.44 💥🚀 #xlm $xlm #stellarorg #stellarlumens #stellar #lumens  https://t.co/ZGZIH7jtYE,en,"[{'screen_name': 'jedmccaleb', 'name': 'jed mccaleb', 'id': '3194838079'}]",[],['https://pbs.twimg.com/media/ErDWWCGWMAAwCdy.jpg'],1,0,12,"['xlm', 'stellarorg', 'stellarlumens', 'stellar', 'lumens']",['xlm']
2021-01-06 08:29:43 EST,I love u #xlm!! 📈📈📈😍 #eth $btc $sxp $xrp $rsr $atom $bull $bear $nano $fun $grt $mkr  For those who don't know! The Stellar Development Foundation [SDF] destroyed 55 billion lumens [XLM] worth $ 4.4 billion last year.  THIS IS BURN!! 🔥🔥🔥🔥  https://t.co/2lM3gdcSoQ,en,[],[],['https://pbs.twimg.com/media/ErDU5nwXAAExqlG.png'],0,0,1,"['xlm', 'eth']","['btc', 'sxp', 'xrp', 'rsr', 'atom', 'bull', 'bear', 'nano', 'fun', 'grt', 'mkr']"
2021-01-06 08:21:16 EST,Stellar lumens 😌,sv,[],[],[],0,0,0,[],[]
2021-01-06 08:16:52 EST,Stellar Lumens(XLM)のネットワークが混雑な状況が続いているため送金機能を一時停止しております。ご不便をおかけしますがご理解のほどよろしくお願い致します。,ja,[],[],[],3,37,160,[],[]
2021-01-06 08:12:53 EST,Who holds Stellar Lumens 👀,en,[],[],[],1,0,5,[],[]
2021-01-06 08:11:30 EST,Stellar Lumens what you trying to do👀,en,[],[],[],0,0,1,[],[]
2021-01-06 08:08:38 EST,on n’en parle du stellar Lumens ?,fr,[],[],[],0,0,0,[],[]
2021-01-06 08:08:27 EST,Stellar Lumens cryptocurrency is up 106% rn.. I purchase $50 worth at 15cent use my link to get free crypto just complete the quiz  https://t.co/7YJewXwsDT,en,[],['https://coinbase.com/earn/xlm/invite/qfhrbtkj'],[],0,0,0,[],[]
2021-01-06 08:07:49 EST,"🔰 The $XLM token price is now heading for the Galaxy  📃 According to data form @CoinGecko , the token of #Stellar Lumen (#XLM) is now up 116% in only 24 hours.  @StellarOrg  #Funda #News #Cryptoland #Crypto #CryptoCurrency #CryptoMarket #BlockChain #HODL #ToTheMoon  https://t.co/VkEgBAK9Le",en,"[{'screen_name': 'coingecko', 'name': 'coingecko', 'id': '2412652615'}, {'screen_name': 'stellarorg', 'name': 'stellar', 'id': '2460502890'}]",[],['https://pbs.twimg.com/media/ErDQeWkW8AAaq1a.jpg'],1,0,3,"['stellar', 'xlm', 'funda', 'news', 'cryptoland', 'crypto', 'cryptocurrency', 'cryptomarket', 'blockchain', 'hodl', 'tothemoon']",['xlm']
2021-01-06 08:05:44 EST,Invest in Stellar Lumens,it,[],[],[],1,0,0,[],[]
2021-01-06 08:04:06 EST,@PraisePandora Ooo imma keep that noted brand protocol and stellar lumens rn are looking fire,en,[],[],[],0,0,0,[],[]
2021-01-06 08:01:58 EST,Stellar lumens &amp; EOS 🚀 💰,fr,[],[],[],0,0,0,[],[]
2021-01-06 08:01:31 EST,Segui un corso su una nuova crypto e guadagna:  https://t.co/8IaFx5ShNq #stellar #xlm #lumens #free #earn #bitcoin #digitalcurrency,it,[],['https://coinbase.com/earn/xlm/invite/scf6w7yv'],[],0,0,2,"['stellar', 'xlm', 'lumens', 'free', 'earn', 'bitcoin', 'digitalcurrency']",[]
2021-01-06 07:57:35 EST,"Sold $XRP as the news broke Ripple is in trouble with SEC. Bought $XLM, stellar lumens and what a Stellar performance in a week. 120% gain. Love crypto. Trade crypto at Coinbase app using the link :  https://t.co/vZuYv0sbjZ",en,[],['http://coinbase.com/join/nahar_mq?src=ios-link'],[],0,0,0,[],"['xrp', 'xlm']"
2021-01-06 07:51:41 EST,@CarrascosaCris_ Yo acabo de flipar con las Stellar lumens,es,[],[],[],0,0,1,[],[]
2021-01-06 07:51:00 EST,"Stellar Lumens up 127% in a day. I closed a spread bet trade yesterday when I closed my hugely profitable eth trades 🙈🙈😬...luckily I hold XLM in my trading account and am £650 on xlm alone today and £1,135 up on band  in one day. My spread bet was leveraged and closing that …",en,[],[],[],0,0,0,[],[]
2021-01-06 07:50:47 EST,@BundleAfrica you guys are doing awesome work. I think you should add Stellar Lumens(XLM) and Carano to the list of cryptos available. It'll be a great addition.,en,[],[],[],0,1,2,[],[]
2021-01-06 07:49:27 EST,"Wem Bitcoin zu langweilig ist, der kann ja mal Stellar Lumens angucken 🤔 #crypto #xlm #btc  https://t.co/EnHmVMNOwr",de,[],['https://www.tradingview.com/chart/?symbol=BITSTAMP%3AXLMUSD'],[],0,0,0,"['crypto', 'xlm', 'btc']",[]
2021-01-06 07:49:16 EST,#XLM Stellar Lumens up 118% today alone as Ukraine selects it to develop its digital asset infrastructure,en,[],[],[],0,2,4,['xlm'],[]
2021-01-06 07:48:41 EST,El que compró stellar lumens a $25....  https://t.co/hCu2q6YIhH,es,[],[],['https://pbs.twimg.com/media/ErDMPciW4AE7NPb.jpg'],1,0,3,[],[]
2021-01-06 07:47:07 EST,STELLAR LUMENS,sv,[],[],[],2,2,36,[],[]
2021-01-06 07:47:03 EST,#XLM update- hit $0.42 from $0.265. Stellar Lumen finally catching on the Bitcoin rally. FYI - it’s an intermediary currency that facilitates currency exchange. Stellar allows a user to send any currency they own to someone else in a different currency  #Crypto  #BTC $XLM #XLM,en,[],[],[],1,0,0,"['xlm', 'crypto', 'btc', 'xlm']",['xlm']
2021-01-06 07:46:36 EST,Stellar Lumens is going crazy! Keep going. #XLM 📈  https://t.co/CzA41pCe2R,en,[],[],['https://pbs.twimg.com/media/ErDLxAJXIAEqCq4.jpg'],2,0,0,['xlm'],[]
2021-01-06 07:46:17 EST,Fuck BTC and ETH send me Stellar Lumens if you’re really about it,en,[],[],[],1,0,4,[],[]
2021-01-06 07:45:44 EST,"Dites, avez-vous vu le cours du Stellar Lumens depuis hier ? #Crypto",fr,[],[],[],1,0,0,['crypto'],[]
2021-01-06 07:45:24 EST,Stellar Lumens #XLM topped off  @ .44 c this morning 🤩 wowza! Go baby go!,en,[],[],[],3,1,15,['xlm'],[]
2021-01-06 07:44:26 EST,Stellar Lumens for the quick double 💪,en,[],[],[],0,0,1,[],[]
2021-01-06 07:43:19 EST,"@360_trader I couldn’t just sit there and watch everyone else make money, I sold a little got into Tezos, Algorand, Stellar Lumens, great decision",en,[],[],[],0,0,3,[],[]
2021-01-06 07:42:50 EST,"La plataforma Coinbase está regalando stellar lumens, si alguien quiere sólo inbox. Va hacer La criptomoneda del año.",es,[],[],[],2,0,1,[],[]
2021-01-06 07:42:12 EST,Can somebody explain why #xlm so bullish?  #Stellar #lumen #Crypto,en,[],[],[],0,0,0,"['xlm', 'stellar', 'lumen', 'crypto']",[]
2021-01-06 07:40:57 EST,@Crypto_Guy_UK I just read some articles other investors of Ripple ship to stellar lumens,en,[],[],[],0,0,1,[],[]
2021-01-06 07:40:56 EST,👍💥🚀#xlm $xlm #stellarorg #stellarlumens #stellar #lumens,und,[],[],[],0,0,3,"['xlm', 'stellarorg', 'stellarlumens', 'stellar', 'lumens']",['xlm']
2021-01-06 07:40:24 EST,"If #xlm get to 0.4$ and is still there in august, i think it is possible to reach the magic one Dollar  in 2021 what do you guys think? #xlm #stellar #lumen #crypto #duesseldorf #germany #altcoin  https://t.co/Q0M5C4SqEF",en,[],[],['https://pbs.twimg.com/media/ErDKWHfXIAAydt0.jpg'],0,0,4,"['xlm', 'xlm', 'stellar', 'lumen', 'crypto', 'duesseldorf', 'germany', 'altcoin']",[]
2021-01-06 07:39:56 EST,El año pasado la gente de @KeybaseIO regaló Lumens (Stellar XLM) a sus usuarios. Hoy está por las nubes y subiendo!!  Ucrania lo usará como crypto nacional. Aquí regalan algunos:  https://t.co/T9cLsRJlXM,es,"[{'screen_name': 'keybaseio', 'name': 'keybase', 'id': '2374780429'}]",['https://coinbase.com/earn/xlm/invite/hc32w47p'],[],0,0,0,[],[]
2021-01-06 07:38:47 EST,Stellar Lumens are booming right now #XLM $XLM,en,[],[],[],0,0,0,['xlm'],['xlm']
2021-01-06 07:36:00 EST,"Want to earn free Stellar Lumens $XLM ? You don't want to miss out! Use my ref link below to get some FREE #XLM ! Earn $50 of XLM now! Watch video and answer questions, get XLM instantly after.  #free #crypto #signup #giveaway #befast #XLM $BTC $ETH   https://t.co/Vs3UNw0q09",en,[],['https://coinbase.com/earn/xlm/invite/q2k4crg1'],[],0,0,0,"['xlm', 'free', 'crypto', 'signup', 'giveaway', 'befast', 'xlm']","['xlm', 'btc', 'eth']"
2021-01-06 07:28:27 EST,"$XLM i on 🔥, weboth could get ome free #lumens ;)    https://t.co/vKQUqNfyZB  #dogecoin",en,[],['https://coinbase.com/earn/xlm/invite/m762rwpq'],[],0,1,1,"['lumens', 'dogecoin']",['xlm']
2021-01-06 07:24:48 EST,@HiddenCash when I made the comment about 5 1/2 hrs ago about Stellar Lumens (XLM) Crypto it was at $.27 .. dipped to $.24 shortly after and as of the time of me posting this it is now at $.35 ..it’s not a long term play but as I said IMO it’s a very good short term until APR/MAY,en,[],[],[],2,0,0,[],[]
2021-01-06 07:24:41 EST,"@inviertracional @JabulaniRuiz @alejandroalv87 @Rapinpla @ricksanxhez @arranzcanojaime Parece que mi apuesta por Stellar lumens ha decidido despertar el día de Reyes... Árbitro, minuto y resultado  https://t.co/bnu7H3rKwe",es,[],[],['https://pbs.twimg.com/media/ErDGv4fXEAkrSd9.jpg'],1,0,1,[],[]
2021-01-06 07:21:09 EST,Stellar Lumens #XLM +80% after Ukraine announced to pick #Stellar to develop a digital asset infrastructure! My position is now up &gt;460% 🚀 #Cryptocurrency #Blockchain #StellarLumens #Ukraine  https://t.co/XBIo7zzv4H,en,[],[],['https://pbs.twimg.com/media/ErDFIKzW8AIhRKS.jpg'],1,2,4,"['xlm', 'stellar', 'cryptocurrency', 'blockchain', 'stellarlumens', 'ukraine']",[]
2021-01-06 07:20:32 EST,Wow hello Stellar Lumens 🤠  https://t.co/qVgiCIkIbf,en,[],[],['https://pbs.twimg.com/media/ErDFzJwVkAIA1Tm.jpg'],4,1,12,[],[]
2021-01-06 07:19:38 EST,「Stellar Lumens(ステラルーメン)」が1日30%以上もの高騰 リップル組の移行・ウクライナ中央銀行との提携  https://t.co/OAbAYXBK4I,ja,[],['https://cubeglb.com/media/2021/01/06/stellarlumens0106/'],[],0,0,1,[],[]
2021-01-06 07:18:01 EST,"I have been telling you guys about Stellar Lumens since $0.13 cents.  We are currently are at $0.33 cents but we have a lot more action to go this year.    I HODL $XLM Long Term!  Like if you are Happy😀, Retweet if you want more🚀",en,[],[],[],5,124,49,[],['xlm']
2021-01-06 07:17:18 EST,Breve storia felice: ieri mattina ho avuto la malsana idea di cambiare BTC in Stellar Lumens (XLM)...   Un sentito ringraziamento al governo Ucraino per la calza della befana.  https://t.co/HrIiQP8hZG,it,[],[],"['https://pbs.twimg.com/media/ErDFDMDXAAIQ3_F.jpg', 'https://pbs.twimg.com/media/ErDFDMGXYAA5Whh.jpg']",2,0,6,[],[]
2021-01-06 07:15:57 EST,Stellar Lumens #XLM uçtu.  https://t.co/Utg5IUfKJD,tr,[],[],['https://pbs.twimg.com/media/ErDEwEEW8AAocvV.jpg'],0,1,1,['xlm'],[]
2021-01-06 07:14:43 EST,based Stellar lumens  cleanest $500 snatch,en,[],[],[],1,0,8,[],[]
2021-01-06 07:10:26 EST,Stellar Lumens めっちゃ荒れてていいね,ja,[],[],[],0,0,1,[],[]
2021-01-06 07:10:07 EST,"Ladies and gentlemen, Stellar Lumens @StellarOrg $XLM  https://t.co/Y6CBMzS4tB  https://t.co/QENbJLE6hd",en,"[{'screen_name': 'stellarorg', 'name': 'stellar', 'id': '2460502890'}]",['https://www.tradingview.com/x/gOJ7uGH1'],['https://pbs.twimg.com/media/ErDDaOxVEAEb68_.png'],1,0,1,[],['xlm']
2021-01-06 07:07:42 EST,"@frxresearch @AaveAave Thanks for sharing - so news hype  Are you following Stellar Lumens closely?  Anything beyond the announcement/PR phase happening on XLM @frxresearch?  (genuinely curious, I know 0 XLM enthusiast)",en,"[{'screen_name': 'frxresearch', 'name': 'frxresearch', 'id': '2775368911'}]",[],[],2,0,1,[],[]
2021-01-06 07:07:32 EST,@ranchedcruz Lol unfortunately the graph is the only one i have that isn’t drastically higher lol but litecoin ethereum stellar lumens been blowing up,en,[],[],[],1,0,2,[],[]
2021-01-06 07:00:01 EST,Gila stellar lumens +78% #XLM,sv,[],[],[],0,0,1,['xlm'],[]
2021-01-06 06:59:09 EST,stellar lumensえげつないくらい上がってるな... 数日で2倍以上に...,ja,[],[],[],1,0,0,[],[]
2021-01-06 06:54:02 EST,"@elonmusk This can only mean one thing, XLM Stellar Lumens will surpass XRP and Elon Knows it, Space war robots in our atmosphere by 2025",en,[],[],[],0,0,0,[],[]
2021-01-06 06:53:40 EST,@not_cosgrove @digitalassetbuy Lucis or Lucifer trust &gt; stellar lumens... They are Satan worshippers...READ  https://t.co/4lo86PMQlK,en,[],[],['https://pbs.twimg.com/media/ErC_pn3XAAE8Fof.jpg'],0,0,0,[],[]
2021-01-06 06:47:10 EST,I have a good feeling stellar lumens will reach $1 this year $XLM,en,[],[],[],9,1,29,[],['xlm']
2021-01-06 06:46:51 EST,$XLM #XLM at .30 cents 🥂🔥🔥🔥 #stellar #lumens #SDR #XRP #LINK  https://t.co/IKrkGSAywF,en,[],[],['https://pbs.twimg.com/media/ErC-FrCXEAI9KOz.jpg'],0,0,0,"['xlm', 'stellar', 'lumens', 'sdr', 'xrp', 'link']",['xlm']
2021-01-06 06:44:57 EST,who wouldn't dream to be paid to study?  https://t.co/NvHPbRwfjB learn about lumen #stellar and earn 50$ in #crypto today #paidtostudy #free,en,[],['http://coinbase.com/earn/xlm/invite/1ymv89jg'],[],0,0,0,"['stellar', 'crypto', 'paidtostudy', 'free']",[]
2021-01-06 06:30:01 EST,My mate James keeps telling me about the money he made on stellar lumens while he slept. James is a noob and gone straight for shitcoins. Please can you drop your comments to James below? Kthx.,en,[],[],[],2,0,0,[],[]
2021-01-06 06:29:39 EST,STELLAR FUCKING LUMENS!! 🥳🥳,en,[],[],[],0,0,1,[],[]
2021-01-06 06:28:04 EST,Well that happened quicker than expected. #xlm #xrp #stellar #lumens,en,[],[],[],0,1,3,"['xlm', 'xrp', 'stellar', 'lumens']",[]
2021-01-06 06:24:38 EST,"ho-lee-shit, did I pick the right time to throw some cash at Stellar Lumens",en,[],[],[],1,0,1,[],[]
2021-01-06 06:20:13 EST,If XRP is still worth $0.23 then XLM is worth at least $ 2.30! 💥🚀 #xlm $xlm #xrp $xrp #stellarorg #stellarlumens #ripple #stellar #lumens  https://t.co/ihYM3lqdO4,en,[],[],['https://pbs.twimg.com/media/ErC3_f8W8AAHqQx.jpg'],3,0,7,"['xlm', 'xrp', 'stellarorg', 'stellarlumens', 'ripple', 'stellar', 'lumens']","['xlm', 'xrp']"
2021-01-06 06:19:00 EST,Stellar Lumens Aufschwung. Verdient euch hier ein bisschen  https://t.co/nBcjZZRhb0,de,[],['https://bit.ly/3pTC3L1'],[],0,0,0,[],[]
2021-01-06 06:18:09 EST,Okay stellar lumens!,en,[],[],[],0,0,0,[],[]
2021-01-06 06:14:42 EST,"Wtf are Stellar Lumens $xlm, why do I have some on my crypto and why have they doubled/almost tripled in a week? 😂🤷‍♀️ I have no clue where these came from. Maybe I screwed up a transfer and didn’t notice til now because they’re para",en,[],[],[],2,0,0,[],['xlm']
2021-01-06 06:11:42 EST,"I new it, something huge in Stellar Lumens Land this way comes",en,[],[],[],0,0,0,[],[]
2021-01-06 05:54:27 EST,@PedriyoGong Stellar lumens men  https://t.co/VJefekCCk3,sv,[],[],['https://pbs.twimg.com/media/ErCyGOvXcAIPtcq.jpg'],0,0,1,[],[]
2021-01-06 05:41:31 EST,$xlm looking for a supernova move  #lumens #cryptocurrency,en,[],[],[],0,0,0,"['lumens', 'cryptocurrency']",['xlm']
2021-01-06 05:39:48 EST,30 reasons for Stellar Lumens /r/CryptoCurrency  https://t.co/Ozs0qD5Yfj  https://t.co/2fuWFQCq5i,en,[],['https://ift.tt/3ov48YI'],['https://pbs.twimg.com/media/ErCuvnxXYAIZD9f.jpg'],0,0,0,[],[]
2021-01-06 05:27:11 EST,Coinbase-wypłacalne  Odbierz zaproszenie i zarób tokeny BAND   https://t.co/pb0Tze4u6z  Odbierz zaproszenie i zarób tokeny Compound COMP   https://t.co/daCNmMjT4M  Odbierz zaproszenie i zarób tokeny Stellar Lumens XLM   https://t.co/1izCZWSMld,pl,[],"['https://coinbase.com/earn/band/invite/739zq6kn', 'https://coinbase.com/earn/comp/invite/89n50yz2', 'https://coinbase.com/earn/xlm/invite/rxs6wj7c']",[],0,1,0,[],[]
2021-01-06 04:43:28 EST,"@iTrendlines Unfortunately this time seems to be not the same shit. Obviously, major bags of $XRP dumped into $XLM. And first time in history we see stellar lumens’ price higher than ripple’s.",en,[],[],[],1,0,2,[],"['xrp', 'xlm']"
2021-01-06 04:32:42 EST,#XLM $XLM  Stellar lumens another Run 🏃🏼‍♀️  👏,en,[],[],[],0,0,1,['xlm'],['xlm']
2021-01-06 04:26:01 EST,@Cointelegraph Hey @JedMcCaleb! Back to work en get those Italian bankers on board! #xlm $xlm #stellarorg #stellarlumens #stellar #lumens #CBDC,en,"[{'screen_name': 'jedmccaleb', 'name': 'jed mccaleb', 'id': '3194838079'}]",[],[],0,1,3,"['xlm', 'stellarorg', 'stellarlumens', 'stellar', 'lumens', 'cbdc']",['xlm']
2021-01-06 04:20:06 EST,XLM Price Surges as Ukraine Selects Stellar Lumens for CBDC Development  https://t.co/GGPCzxgChm  https://t.co/DOU9iIoqO0,en,[],['https://www.thedailybuzz.io/business-news/xlm-price-surges-as-ukraine-selects-stellar-lumens-for-cbdc-development/'],['https://pbs.twimg.com/media/ErCcgDUXIAAn488.jpg'],0,0,0,[],[]
2021-01-06 04:10:30 EST,"Stellar Lumens - $XLM  fiyatı, Ukrayna ile gerçekleştirdiği işbirliği sonrasında bugün 0,26$ seviyesine tırmandı.🚀🇺🇦  An itibariyle 0,25$ seviyesinden fiyatlanan #XLM, fiyatı 0,22$ olan #XRP’yi geçerek tarihinde bir ilk yaşadı.🎉💫  https://t.co/D74R1kCF9a",tr,[],[],['https://pbs.twimg.com/media/ErCaD3xXAAE6yyi.jpg'],3,1,22,"['xlm', 'xrp']",['xlm']
2021-01-06 04:02:21 EST,「Stellar Lumens(ステラルーメン)」が1日30%以上もの高騰 リップル組の移行・ウクライナ中央銀行との提携  https://t.co/aRyU2kaJsH  https://t.co/R9DSJZkF0p,ja,[],['https://ift.tt/2LnaESP'],['https://pbs.twimg.com/media/ErCYcI1W4AEL-RF.jpg'],0,0,2,[],[]
2021-01-06 03:57:51 EST,È proprio il caso di dirlo. Chi ha seguito la #Stellar cometa oggi ha trovato più #lumens 😂 #6gennaio #Epifania (si scherza eh),it,[],[],[],0,0,3,"['stellar', 'lumens', '6gennaio', 'epifania']",[]
2021-01-06 03:52:55 EST,XLM Price Surges as Ukraine Selects Stellar Lumens for CBDC Development  https://t.co/9LSxQG84IM,en,[],['https://maxbit.cc/xlm-price-surges-as-ukraine-selects-stellar-lumens-for-cbdc-development/'],[],0,0,0,[],[]
2021-01-06 03:46:46 EST,Position 10 already in sight! 👁 #xlm $xlm #stellarorg #stellarlumens #stellar #lumens #CBDC  https://t.co/4UUbwZcbk9,en,[],[],['https://pbs.twimg.com/media/ErCU3vyXIAE6H3t.jpg'],3,1,12,"['xlm', 'stellarorg', 'stellarlumens', 'stellar', 'lumens', 'cbdc']",['xlm']
2021-01-06 03:46:14 EST,@kucoincom #xlm Stellar Lumens ($XLM) Macro-Megalithic-Ultimate MOON Potential  https://t.co/8j58R9jplc,en,[],['https://youtu.be/lPazSA8z_po'],[],0,0,0,['xlm'],[]
2021-01-06 03:44:21 EST,Stellar lumens,sv,[],[],[],0,0,0,[],[]
2021-01-06 03:43:04 EST,Stellar Lumens ($XLM) Macro-Megalithic-Ultimate MOON Potential  https://t.co/8j58R9jplc 🚀🚀💹💹 #crypto #stellar #xrp #xlm #eth #btc,en,[],['https://youtu.be/lPazSA8z_po'],[],0,0,1,"['crypto', 'stellar', 'xrp', 'xlm', 'eth', 'btc']",[]
2021-01-06 03:42:37 EST,30 reasons for Stellar Lumens #cryptoking,en,[],[],[],0,0,0,['cryptoking'],[]
2021-01-06 03:40:25 EST,"30 reasons for Stellar Lumens  https://t.co/v7lowFLyHv January 05, 2021 at 10:44PM #CryptoCurrency",en,[],['https://ift.tt/3hPPOrl'],[],0,0,0,['cryptocurrency'],[]
2021-01-06 03:37:31 EST,"https://t.co/lx2ibxDEa8  Consigue algo de Stellar Lumens, de  ayer a hoy +70%.",es,[],['https://coinbase.com/earn/xlm/invite/9bw5vysd'],[],1,0,0,[],[]
2021-01-06 03:27:32 EST,XLM Price Surges as Ukraine Selects Stellar Lumens for CBDC Development  https://t.co/BIeX9Jqfuw,en,[],['https://latestcrypto.news/xlm-price-surges-as-ukraine-selects-stellar-lumens-for-cbdc-development/'],[],0,0,0,[],[]
2021-01-06 03:26:04 EST,XLM Price Surges as Ukraine Selects Stellar Lumens for CBDC Development  https://t.co/L2Ie60tPGR,en,[],['https://mycryptonews.buzz/xlm-price-surges-as-ukraine-selects-stellar-lumens-for-cbdc-development/'],[],0,0,0,[],[]
2021-01-06 03:19:49 EST,did you buy #XLM Stellar Lumens??  @ 0.27 cents now usd  ~ t,en,[],[],[],0,0,3,['xlm'],[]
2021-01-06 03:19:49 EST,"Some of the cryptos seem like jokes, but could genuinely see $XLM gaining global adoption amongst banks around the world. Watched a few videos, answered some easy questions &amp; they gave me free Lumens. Not bad.",en,[],[],[],1,0,0,[],['xlm']
2021-01-06 03:17:17 EST,these lumens are really stellar 🚀,en,[],[],[],0,0,0,[],[]
2021-01-06 03:13:34 EST,Stellar Lumens( $XLM ) +78% hoje 22%+ ultima hora,ro,[],[],[],4,1,28,[],['xlm']
2021-01-06 03:09:10 EST,ビットコインが連日値上がりしていますが、本日もう一つ、顕著な値上がりを見せたコインがあります「Stellar Lumens(ステラルーメン)」です。  「Stellar Lumens(ステラルーメン)」が1日30%以上もの高騰 リップル組の移行・ウクライナ中央銀行との提携  https://t.co/AM6WtP0ykO @CUBE_MEDIA_Rより,ja,"[{'screen_name': 'cube_media_r', 'name': 'cube media', 'id': '1315963856766738432'}]",['https://cubeglb.com/media/2021/01/06/stellarlumens0106/'],[],0,1,1,[],[]
2021-01-06 03:03:47 EST,@HiddenCash you asked earlier about stocks. I mentioned 2 Cryptocurrencies. I will make it just 1 now. For about $280 you. An get 1000 parts of XLM Stellar Lumens. I am going with a conservative prediction of a rise to $1 (currently $.27)   Will you go out on a limb and try it??,en,[],[],[],1,0,0,[],[]
