created_at,tweet,language,mentions,urls,photos,replies_count,retweets_count,likes_count,hashtags,cashtags
2021-01-01 13:45:26 EST,Stellar Lumen based Federated Credit Exchange performs first live transaction -  https://t.co/66dK6GtxDh,en,[],['https://cryptonews19.com/stellar-lumen-based-federated-credit-exchange-performs-first-live-transaction/'],[],0,1,1,[],[]
2021-01-01 13:25:28 EST,"*Coinbase, XRP, Bittrex, FinCEN &amp; Stellar*  https://t.co/cCh7YJy4CZ via @YouTube #coinbase #xrp #bittrex #stellar #lumens #xlm #velo #dash #xmr #zec #lightnetgroup #sebabank #fcx #blockchain #dlt",en,"[{'screen_name': 'youtube', 'name': 'youtube', 'id': '10228272'}]",['https://youtu.be/YX9zlmbx9gU'],[],1,1,12,"['coinbase', 'xrp', 'bittrex', 'stellar', 'lumens', 'xlm', 'velo', 'dash', 'xmr', 'zec', 'lightnetgroup', 'sebabank', 'fcx', 'blockchain', 'dlt']",[]
2021-01-01 12:40:01 EST,📈Stellar Lumen (XLM) a pris +10.55% pour atteindre 0.14$ dans les dernières 24 heures. #XLM #cryptomonnaie,fr,[],[],[],0,0,0,"['xlm', 'cryptomonnaie']",[]
2021-01-01 12:21:51 EST,"Just got a notification that Stellar Lumens #XLM is up 10%. This is only open to eligible users, but hey - #freecrypto #freebies #Coinbase   https://t.co/YT59TbGpeD",en,[],['https://coinbase.com/earn/xlm/invite/sm71n03j'],[],1,1,1,"['xlm', 'freecrypto', 'freebies', 'coinbase']",[]
2021-01-01 11:59:25 EST,stellar lumens or XRP in 2021,nl,[],[],[],1,0,0,[],[]
2021-01-01 11:46:51 EST,Stellar Lumens Price Analysis: 01 January  Disclaimer: The findings of the following analysis are the sole opinions of the writer and should not be taken as investment advice In ...  https://t.co/S4pJChSnC5 #CryptoNews,en,[],['https://bit-news.ch/2021/01/stellar-lumens-price-analysis-01-january/'],[],0,0,0,['cryptonews'],[]
2021-01-01 10:40:59 EST,Stellar XLM - TRILLION DOLLAR MARKET CAP!!! Velo Protocol &amp; Smart Contracts &amp; DeFi!!!  #Stellar #XLM #Lumen #VELO #DeFi #Blockchain #Crypto #cryptocurrencies #cryptocurrencynews #CryptocurrencyMarket #fintech #cbdc   https://t.co/hruSCLfVjj,en,[],['https://youtu.be/lwYj5In5K7E'],[],2,0,2,"['stellar', 'xlm', 'lumen', 'velo', 'defi', 'blockchain', 'crypto', 'cryptocurrencies', 'cryptocurrencynews', 'cryptocurrencymarket', 'fintech', 'cbdc']",[]
2021-01-01 10:02:29 EST,"Started the year with a bit more ""Risk-taking"".  Had some cash on coinbase left and put it in $BTC. I also transferred some of the free Stellar Lumens (XLM) I got from Coinbase into AAVE.  P.S.: Want to receive free XLM? I got an invite for you then 😎  https://t.co/M1r1fJ94jv",en,[],['http://base.com/earn/xlm/invite/7qsnchy3'],[],1,0,3,[],['btc']
2021-01-01 10:00:10 EST,Stellar Lumen based Federated Credit Exchange performs first transaction #xlm $xlm #stellarorg #stellarlumens #stellar #lumens #xrp #ripple   https://t.co/XfE8eyt5Ui,en,[],['https://www.crypto-news-flash.com/stellar-lumen-based-federated-credit-exchange-performs-first-live-transaction/'],[],0,3,17,"['xlm', 'stellarorg', 'stellarlumens', 'stellar', 'lumens', 'xrp', 'ripple']",['xlm']
2021-01-01 09:35:47 EST,"@rickeutsch @moveValuefast @StellarOrg @Ripple Tell me how it is different besides the company behind it? Even factoring in the company and its practices, stellar retains the lions share of lumens. Only reason for all the confusion is stellar isn't nearly as transparent as ripple.",en,[],[],[],1,0,0,[],[]
2021-01-01 09:28:02 EST,Stellar Lumens Price Analysis: 01 January  https://t.co/MtpMOjT2M6 #crypto #bitcoin #fintech #finance #news,en,[],['https://ambcrypto.com/stellar-lumens-price-analysis-01-january'],[],0,0,1,"['crypto', 'bitcoin', 'fintech', 'finance', 'news']",[]
2021-01-01 09:21:11 EST,Share me your thoughts! What value do you think xlm will be at the end of this year?! #xlm $xlm #stellarorg #stellarlumens #stellar #lumens Or do you hodl  because of the technology?!,en,[],[],[],1,3,8,"['xlm', 'stellarorg', 'stellarlumens', 'stellar', 'lumens']",['xlm']
2021-01-01 08:14:23 EST,Stellar Lumens Price Analysis: 01 January -  https://t.co/OOHDPcTgKV  https://t.co/af40kbWKvp,en,[],['https://cryptonewsify.com/stellar-lumens-price-analysis-01-january/'],['https://pbs.twimg.com/media/EqpiLHwXMAAawpL.png'],0,0,0,[],[]
2021-01-01 07:24:33 EST,Stellar Lumens Price Analysis: 01 January - AMBCrypto News  https://t.co/rHmGCpyxPx 🚀 Bet with $BTC via  ⟶  https://t.co/IZRIXuhFIf √  https://t.co/Top7Ib90Ru,en,[],"['http://dlvr.it/Rpk5hY', 'http://buff.ly/2T7HGYK']",['https://pbs.twimg.com/media/EqpWxU3UwAEvoFX.jpg'],0,1,0,[],['btc']
2021-01-01 06:04:18 EST,Stellar Lumens Price Analysis: 01 January - AMBCrypto via BTCnews for iOS  https://t.co/2cgkRHHD1I,en,[],['https://ambcrypto.com/stellar-lumens-price-analysis-01-january'],[],0,0,0,[],[]
2021-01-01 05:35:53 EST,Stellar Lumens XLM News: The Stellar Community Is Thriving  https://t.co/KL3NKINIJi via @YouTube,en,"[{'screen_name': 'youtube', 'name': 'youtube', 'id': '10228272'}]",['https://youtu.be/nr9veSSsiJc'],[],0,0,0,[],[]
2021-01-01 05:14:25 EST,Stellar Lumens Cryptocurrency Approved for Trading in New York for the First Time  https://t.co/kWBSqDf0hJ,en,[],['https://fortune.com/2018/06/14/cryptocurrency-stellar-lumens-buy-itbit/'],[],0,1,0,[],[]
2021-01-01 04:30:33 EST,Stellar Lumens Price #Analysis: 01 January - #Altcoins #HideCryptopanic #News #News1 #Social #TradingView -  https://t.co/NvJRjsrlLA  https://t.co/iqynE2xfX4,en,[],['https://paulcrypto.com/2021/01/01/stellar-lumens-price-analysis-01-january/'],['https://pbs.twimg.com/media/Eqou8VdXUAAfowp.jpg'],0,0,0,"['analysis', 'altcoins', 'hidecryptopanic', 'news', 'news1', 'social', 'tradingview']",[]
2021-01-01 04:30:06 EST,"Found for the #XRPCommunity #XRP ,Stellar Lumens Price Analysis: 01 January, https://t.co/2qpATOacIz",en,[],['https://www.xrpvi.be/stellar-lumens-price-analysis-01-january/'],[],0,0,1,"['xrpcommunity', 'xrp']",[]
2021-01-01 04:10:11 EST,Stellar Lumens Price Analysis: 01 January   https://t.co/xKnpXO7wCp,en,[],['https://ranz.io/1299'],[],0,0,0,[],[]
2021-01-01 04:03:28 EST,Stellar Lumens Price Analysis: 01 January   https://t.co/fYXJKtYCJS,en,[],['https://www.ranzware.com/18312'],[],1,0,0,[],[]
2021-01-01 04:02:38 EST,Stellar Lumens Price Analysis: 01 January  https://t.co/PlcVrZ5GEU,en,[],['https://maxbit.cc/stellar-lumens-price-analysis-01-january/'],[],0,0,0,[],[]
2021-01-01 03:48:20 EST,Stellar Lumens Price Analysis: 01 January  https://t.co/NeN1qj3Syg,en,[],['https://ift.tt/3hBBNO6'],[],0,0,0,[],[]
2021-01-01 03:39:57 EST,New post (Stellar Lumens Price Analysis: 01 January) has been published on  https://t.co/4w7A2E5AtV -  https://t.co/0PX2tELWqm  https://t.co/qaelTyz6Ne,en,[],"['http://Fuzzy.One', 'https://www.fuzzy.one/blog/2021/01/01/stellar-lumens-price-analysis-01-january/']",['https://pbs.twimg.com/media/EqojXT_VoAAaEk2.png'],0,0,1,[],[]
2021-01-01 03:31:21 EST,Stellar Lumens Price Analysis: 01 January   https://t.co/8zBJVJ4iEq,en,[],['https://ambcrypto.com/stellar-lumens-price-analysis-01-january/'],[],0,0,0,[],[]
2021-01-01 03:31:21 EST,Análisis de precios de Stellar Lumens: 01 de enero  https://t.co/sseGc0uWsq,es,[],['https://es.ambcrypto.com/analisis-de-precios-de-stellar-lumens-01-de-enero/'],[],0,1,0,[],[]
2021-01-01 03:30:01 EST,Stellar Lumens Price Analysis: 01 January  https://t.co/5WEU7C8n6K,en,[],['https://ambcrypto.com/stellar-lumens-price-analysis-01-january/'],[],0,0,0,[],[]
2021-01-01 03:27:29 EST,"Disclaimer: The findings of the following analysis are the sole opinions of the writer and should not be taken as investment advice In 2020, Stellar Lumens...Read more:  https://t.co/DGS5VlSGkh",en,[],['https://ambcrypto.com/stellar-lumens-price-analysis-01-january/'],[],0,0,0,[],[]
2021-01-01 03:12:30 EST,Stellar Lumens Price Analysis: 01 January  https://t.co/f9T4Wd1lZk,en,[],['https://latestcrypto.news/stellar-lumens-price-analysis-01-january/'],[],0,0,0,[],[]
2021-01-01 03:08:56 EST,Stellar Lumens Price Analysis: 01 January -  https://t.co/lrZyEzgQ4J #Crypto #CryptoNews $BTC #ETH #Bitcoin,en,[],['https://hodlersdigest.com/stellar-lumens-price-analysis-01-january/'],[],0,0,0,"['crypto', 'cryptonews', 'eth', 'bitcoin']",['btc']
2021-01-01 03:05:38 EST,Stellar Lumens Price Analysis: 01 January   https://t.co/16Zy4Gt5rm,en,[],['https://ambcrypto.com/stellar-lumens-price-analysis-01-january/'],[],0,0,0,[],[]
2021-01-01 03:03:41 EST,Stellar Lumens Price Analysis: 01 January   https://t.co/Bb8n04xHRX,en,[],['https://ambcrypto.com/stellar-lumens-price-analysis-01-january/'],[],0,1,0,[],[]
2021-01-01 03:02:03 EST,Stellar Lumens Price Analysis: 01 January  https://t.co/Rb3dcn2GhN #Altcoins #Analysis #HideCryptopanic #News  https://t.co/LgktLbAlo9,en,[],['https://j.mp/3b4QW9r'],['https://pbs.twimg.com/media/EqoasLFUwAE_01B.jpg'],0,0,0,"['altcoins', 'analysis', 'hidecryptopanic', 'news']",[]
2020-12-31 22:44:57 EST,If been hearing a lot about #XLM lately  I don’t own any but let’s see who backs the Stellar Lumens  ♻️ Retweet ♻️ If you like the Lumens  Let’s see how big this community really is  🚀To the Moon🚀,en,[],[],[],36,160,466,['xlm'],[]
2020-12-31 22:28:50 EST,Stellar Lumens XLM Sleeping Giant or Fading Star in 2021?  https://t.co/WLAzqO2GfB via @YouTube,en,"[{'screen_name': 'youtube', 'name': 'youtube', 'id': '10228272'}]",['https://youtu.be/rQdDjW49U_0'],[],0,0,1,[],[]
2020-12-31 22:14:43 EST,"@MinusWells @MatiGreenspan Stellar Lumens is a silly name..best investment advice out there 😅 On another note, Thailand's largest commercial bank SCB partnered with fintech Lightnet for cross-border payments to S Korea on Stellar based project..hopefully they like the name!",en,[],[],[],1,0,2,[],[]
2020-12-31 21:28:22 EST,"@MatiGreenspan #XRP will get clarity sooner than later while #XLM will still be a liability  #XLM will suffer low volume and lack of interest due to the lack of clarity and legality issue  Time to dump xlm, Stellar Lumens is a silly name anyways  In other words, xlm is going to crash hard",en,[],[],[],2,0,0,"['xrp', 'xlm', 'xlm']",[]
2020-12-31 20:56:13 EST,Just in in the last hour I've added 20% to my bag of $XLM Lumens.   Under .15cents is great buying imo. #stellar #Crypto #lumens #ALTSEASON #notanalt #cryptocurrency #XLM,en,[],[],[],1,1,18,"['stellar', 'crypto', 'lumens', 'altseason', 'notanalt', 'cryptocurrency', 'xlm']",['xlm']
2020-12-31 19:46:13 EST,"Free Stellar Lumens #XLM Crypto new or existing Coinbase customers, limited to 5 so hurry and grab your FREE Crypto here today.  https://t.co/8dGgcwm7zl",en,[],['https://coinbase.com/earn/xlm/invite/7cp3jn8r'],[],0,0,1,['xlm'],[]
2020-12-31 19:31:36 EST,"@NeilMoonstrong The whole I hate Jed McCalub thing blah blah, everybody is sleeping on $xlm, but Ive always thought there was more there than meets the eye🧐. What if the zerps are the trojan horse for the Stellar Lumens.. As a conspiracy theorist 🤔",en,[],[],[],0,0,0,[],['xlm']
2020-12-31 19:29:20 EST,"I sure hope the #XLM freaks have some serious funding like #ripple...  Sounds like #XLM is a security and will be for a long time, for institutions to take them seriously they may have to change their name to something less Stellar Lumens 🤷‍♂️  If I had #XLM I would dump that ASAP",en,[],[],[],6,0,3,"['xlm', 'ripple', 'xlm', 'xlm']",[]
2020-12-31 18:06:47 EST,Stellar Lumens Cryptocurrency Approved for Trading in New York for the First Time – Fortune  https://t.co/9X0gI62IrB not sure if I can tell from this that it is surely not a security.  #xlm,en,[],['https://fortune.com/2018/06/14/cryptocurrency-stellar-lumens-buy-itbit/'],[],0,0,1,['xlm'],[]
2020-12-31 16:09:48 EST,Faulty data? Grayscale didn’t liquidate massive amounts of XRP and XLM #lumens #usd #stellar #stellarlumens #fund  https://t.co/GvnKb8D8Jc,en,[],['https://www.cashtechnews.com/2020/12/31/faulty-data-grayscale-didnt-liquidate-massive-amounts-of-xrp-and-xlm/'],[],0,0,1,"['lumens', 'usd', 'stellar', 'stellarlumens', 'fund']",[]
2020-12-31 13:56:53 EST,@Lewy05019925 @Romik7030 @MatiGreenspan Stellar lumens.,sv,[],[],[],0,0,1,[],[]
2020-12-31 13:54:08 EST,"#BTC #DGB #XLM The Crypto Fear and Greed Index registered a value of 90 at press time, with calls for a deeper Bitcoin correction yet to come to the fore. Stellar Lumens ...Read more:  https://t.co/Mucv9xO2XG",en,[],['https://cryptocontrol.io/r/api/article/5fd4ee05b92a44001ad2508f?ref=5c18dd48f5380900192467dd'],[],0,0,0,"['btc', 'dgb', 'xlm']",[]
2020-12-31 12:47:32 EST,"When there’s blood on the street, I pick off the meat like a scavenger &amp; get the best #DCA (dollar cost average) possible.   Winners in the future I can project NOW:  #XRP / $XRP (XRP) #VET / $VET (VeChain) #RSR / $RSR (Reserve Rights) #XLM / $XLM (Stellar Lumens)",en,[],[],[],0,0,4,"['dca', 'xrp', 'vet', 'rsr', 'xlm']","['xrp', 'vet', 'rsr', 'xlm']"
2020-12-31 12:01:02 EST,💲Good #Crypto - #Coin of the Week: #Stellar (#XLM)  @stellarorg is a payment network that supports use of its native asset called Lumens (XLM).  ✅Trade #XLM in Good Crypto App -  https://t.co/ZQw97DzvPG  https://t.co/vyIKPfqCRX,en,"[{'screen_name': 'stellarorg', 'name': 'stellar', 'id': '2460502890'}]",['https://link.goodcrypto.app/XLM'],['https://pbs.twimg.com/media/EqlMdi5XUAIFlxT.jpg'],0,0,0,"['crypto', 'coin', 'stellar', 'xlm', 'xlm']",[]
2020-12-31 09:28:42 EST,@ACZeroshift Because of a lawsuit. I'd stay away from that coin and just add $XLM(Stellar Lumens) which is the better alternative and they're truly decentralized. Akon's crypto runs on their network too.,en,[],[],[],1,0,4,[],['xlm']
2020-12-31 09:07:17 EST,"por las jajas compre7€ en Bitcoin cuando alcanzó 10.000€ así de pana y ahora tengo 15€, arriba españa, si lo hubiera metido a Stellar Lumens quizá tendría 3 veces más pero na mejor le hago caso a la próxima",es,[],[],[],0,0,2,[],[]
2020-12-31 07:30:49 EST,@cameron Except for Stellar Lumens,en,[],[],[],0,0,4,[],[]
2020-12-31 05:40:14 EST,#XLM #stellar #lumens,und,[],[],[],0,1,6,"['xlm', 'stellar', 'lumens']",[]
2020-12-31 04:33:00 EST,Which fools are selling? xlm in spot 15 🤦🏼 #xlm $xlm #stellarorg #stellarlumens #stellar #lumens  https://t.co/aSCUgrSdX3,en,[],[],['https://pbs.twimg.com/media/Eqjl6h5XYAA278x.jpg'],5,1,6,"['xlm', 'stellarorg', 'stellarlumens', 'stellar', 'lumens']",['xlm']
2020-12-31 04:16:57 EST,Stellar Lumens XLM News: Analytics Dataset  https://t.co/aREJJsJVLD via @YouTube,en,"[{'screen_name': 'youtube', 'name': 'youtube', 'id': '10228272'}]",['https://youtu.be/KscAdZ1g4l0'],[],0,0,0,[],[]
2020-12-31 03:18:06 EST,"Glad I dumped my #XLM a couple of days ago. Even though Stellar has been incredibly compliant and kowtowed to the institutions they want to work with, it doesn't mean Lumens is safe.   #bitcoin #crypto #cryptocurrency #stellar #regulation    https://t.co/V4JAwGvgZi",en,[],['https://cointelegraph.com/news/grayscale-reportedly-dumps-massive-stakes-in-xrp-xlm'],[],0,0,1,"['xlm', 'bitcoin', 'crypto', 'cryptocurrency', 'stellar', 'regulation']",[]
2020-12-31 02:34:53 EST,"@caludio If you bought 2k of an SP500 index in march you would have 3k right now, and an expectation it would still be good for a long time ;) I'm happy BTC is going up, it has pushed by accidental holdings in stellar lumens and $DOGE :)",en,[],[],[],0,0,1,[],['doge']
2020-12-31 00:36:48 EST,USDC coming to Stellar network in February 2021 -  https://t.co/ALzkXJ2F1a #xlm $xlm #stellarorg #stellarlumens #stellar #lumens  🧨💥🚀 Pack your bags!  https://t.co/8VidpNfOOe,en,[],"['http://StellarUpdate.com', 'https://stellarupdate.com/usdc-coming-to-stellar-network-in-february-2021-1106/']",[],2,6,24,"['xlm', 'stellarorg', 'stellarlumens', 'stellar', 'lumens']",['xlm']
2020-12-30 23:57:05 EST,@MrMyskin @JoelKatz Stellar burned such a large portion of the lumens supply so they wouldn't have this dilemma.   https://t.co/8T2qIgPUxn,en,[],['https://twitter.com/haydentiff/status/1343304816823558148?s=19'],[],1,0,0,[],[]
2020-12-30 23:46:36 EST,@Grayscale reducing $XLM assets?  https://t.co/LWjKKUymUi  #STABLEAct got you down?  https://t.co/9QfsJkhRP2  Stellar Lumens $XLM are an asset with a purpose - to pay for fees and accounts on the @StellarOrg network. #usecases   https://t.co/CSyNyBzEYh   https://t.co/OsLQlQX144  https://t.co/7FEtD6E48w,en,"[{'screen_name': 'stellarorg', 'name': 'stellar', 'id': '2460502890'}]","['https://cointelegraph.com/news/grayscale-reportedly-dumps-massive-stakes-in-xrp-xlm', 'https://www.forbes.com/sites/seansteinsmith/2020/12/09/cryptocurrency-legislation-is-on-the-rise--what-the-proposed-stable-act-could-mean-for-crypto/', 'https://www.coindesk.com/satoshipay-to-become-first-user-of-german-banks-euro-stablecoin', 'https://cointelegraph.com/news/stellar-expands-reach-in-latin-america-with-3m-investment-in-settle-network']",['https://pbs.twimg.com/media/EqiiAvuUUAABKF2.jpg'],1,0,3,"['stableact', 'usecases']","['xlm', 'xlm']"
2020-12-30 23:22:17 EST,I think #stellar #lumens #XLM is truly decentralized and it will prevail to be the best alternative to #XRP Holders!,en,[],[],[],2,0,1,"['stellar', 'lumens', 'xlm', 'xrp']",[]
2020-12-30 23:20:32 EST,"DONT BE FOOLED: There is no suspicion out in the crypto industry that ""#stellar foundation"" is holding a major chunk of #lumens #XLM to call it centralized... REED! RT!",en,[],[],[],0,1,1,"['stellar', 'lumens', 'xlm']",[]
2020-12-30 23:16:00 EST,"Bitcoin, Ethereum, Ripple, Chainlink &amp; Stellar Lumens  https://t.co/KhVDKZaIGv",en,[],['https://buff.ly/33otgrO'],[],0,0,0,[],[]
2020-12-30 22:57:08 EST,DONT BE FOOLED: #XRP #Stellar #Lumens Cryptocurrency Approved for Trading in New York  https://t.co/6hZAGy6opJ,en,[],['https://fortune.com/2018/06/14/cryptocurrency-stellar-lumens-buy-itbit/'],[],0,0,0,"['xrp', 'stellar', 'lumens']",[]
2020-12-30 22:12:06 EST,Stellar Lumens (XLM) Big Move Coming? HUGE News! Price Analysis &amp; More!  https://t.co/b73Q0dxDJP via @YouTube,en,"[{'screen_name': 'youtube', 'name': 'youtube', 'id': '10228272'}]",['https://youtu.be/aHduojgQ0BM'],[],1,0,0,[],[]
2020-12-30 20:26:07 EST,"@itBit announces that they now offer expanded regulated trading and custody services for Bitcoin Cash (BCH), Ethereum (ETH), Litecoin (LTC) and Stellar Lumens (XLM).",en,[],[],[],0,0,0,[],[]
2020-12-30 20:22:11 EST,"AWESOME!  itBit Now Offers Ethereum, Bitcoin Cash, Litecoin and Stellar Lumens | Paxos. #XLM 👏🏻  https://t.co/o5WVmAbr0c",en,[],['https://www.paxos.com/zh/itbit-now-offers-ethereum-bitcoin-cash-litecoin-and-stellar-lumens-683e42ab19ba/'],[],0,0,2,['xlm'],[]
2020-12-30 18:28:21 EST,@Dxron2 Lol twas rhetorical 😩 either way Stellar Lumens means light star and then u got ADA - Ouroborus. I just think Ripple coulda came up with a better esoteric meaning. We even got $Om out here,en,[],[],[],0,0,2,[],['om']
2020-12-30 17:59:25 EST,#xlm $xlm #stellarorg #stellarlumens #stellar #lumens 💥🚀  https://t.co/4HNIuDbsRa,und,[],['https://www.crypto-news-flash.com/stellar-lumens-cooperates-with-world-bank-to-improve-traceability-of-loans/'],[],2,3,10,"['xlm', 'stellarorg', 'stellarlumens', 'stellar', 'lumens']",['xlm']
2020-12-30 17:46:07 EST,@_jmgv_ I do not think so. I know that for sure. There is no equal to xlm. Do you need wealth now? you can forget! Do you have the time? Then it will certainly happen. Be patient! #xlm $xlm #stellarorg #stellarlumens #stellar #lumens,en,[],[],[],1,0,1,"['xlm', 'stellarorg', 'stellarlumens', 'stellar', 'lumens']",['xlm']
2020-12-30 17:33:06 EST,It depends on how you see it. BULLISH!!! 💥🚀 #xlm $xlm #stellarorg #stellarlumens #stellar #lumens  https://t.co/SurUnn8645,en,[],[],['https://pbs.twimg.com/media/EqhO319XAAEPte8.jpg'],1,1,4,"['xlm', 'stellarorg', 'stellarlumens', 'stellar', 'lumens']",['xlm']
2020-12-30 17:18:11 EST,@g2g2g5j i bought an engagement ring. wise investment.(stuck the leftovers in stellar lumens at 4.5 cents  :) ),en,[],[],[],0,1,3,[],[]
2020-12-30 16:19:13 EST,"@jamesagardner @nba_topshot Yep.  That's why I figured I'd start dabbling in it.  On Coinbase I've also been playing with: Compound:  https://t.co/CaEUvRdBkB Stellar Lumens:  https://t.co/U7CD8aYwyH Graph, Maker, and Celo.  Then, of course some Ethereum and Litecoin:  https://t.co/aDk029uUrj",en,[],"['https://coinbase.com/earn/comp/invite/fpb2jtcy', 'https://coinbase.com/earn/xlm/invite/s3cpt7mh', 'https://www.coinbase.com/join/jlynn_LQ8Xdw']",[],1,0,0,[],[]
2020-12-30 15:02:22 EST,Stellar Lumens cooperates with World Bank to improve traceability of loans - ELEVENEWS  https://t.co/w36Tkg4RJH,en,[],['https://elevenews.com/2020/12/30/stellar-lumens-cooperates-with-world-bank-to-improve-traceability-of-loans/'],[],0,0,0,[],[]
2020-12-30 14:58:39 EST,"@synetic6 @tradetraderson @AssetsDaily @jacky52103808 @RepMaxineWaters “Stellar has no shareholders, no dividends, &amp; no profit motive. The Foundation is funded by lumens generated at Stellar’s inception. All of those lumens will eventually be used to enhance and promote Stellar, or to pay taxes as we do so.”   https://t.co/Sn6tbmQUQQ",en,[],['https://www.stellar.org/foundation/mandate?locale=en'],[],0,0,0,[],[]
2020-12-30 14:24:08 EST,"Stellar Lumens is only used for cross-broader payments, involving retail and governments   which would make it possible to be centralized.   Just a theory....",en,[],[],[],0,0,0,[],[]
2020-12-30 14:23:47 EST,"Stellar Lumens is Planet Saturn🪐   In astrology, Saturn is associated with restriction and limitation  It also associated with rules, and regulations imposed on us by our authority figures",en,[],[],[],1,0,0,[],[]
2020-12-30 14:01:23 EST,The World Bank is working with Stellar Lumens to improve the traceability &amp; visibility of its loans. World Bank client countries could benefit from cooperation with Stellar... #XLM  #StellarLumens   https://t.co/p1z3zL6syU,en,[],['https://elevenews.com/2020/12/30/stellar-lumens-cooperates-with-world-bank-to-improve-traceability-of-loans/'],[],0,0,2,"['xlm', 'stellarlumens']",[]
2020-12-30 13:44:08 EST,"@LondonBoyPuffy Yea since 2016 tbh. No big positions apart from Ethereum, BTC, lite, ripple (bust) and stellar Lumens (bust)",en,[],[],[],1,0,0,[],[]
2020-12-30 13:32:19 EST,Stellar Lumens cooperates with World Bank to improve traceability of loans - ELEVENEWS  https://t.co/4mLWtL3CgE,en,[],['https://elevenews.com/2020/12/30/stellar-lumens-cooperates-with-world-bank-to-improve-traceability-of-loans/'],[],0,0,0,[],[]
2020-12-30 12:45:17 EST,"What the hell is up with $XLM? Seems just marooned by itself, and going down. Can someone in crypto tell me whats up with Stellar Lumens?",en,[],[],[],2,0,0,[],['xlm']
2020-12-30 12:35:02 EST,"💫🚀Stellar fue creada con el objetivo de facilitar las transacciones más allá de las fronteras y hacerlas más rápidas, baratas y seguras.   Artículo:  https://t.co/mDkgdjuXyn  #stellar #lumens #xlm #criptomonedas #stellarlumens @stellar_coin @lumens_xlm",es,"[{'screen_name': 'stellar_coin', 'name': 'lumens coin', 'id': '2707205622'}, {'screen_name': 'lumens_xlm', 'name': 'stellar lumens xlm', 'id': '947853049724145666'}]",['http://ow.ly/F6dD50CWYzx'],[],0,0,0,"['stellar', 'lumens', 'xlm', 'criptomonedas', 'stellarlumens']",[]
2020-12-30 12:07:59 EST,Stellar Lumens cooperates with World Bank to improve traceability of loans - ELEVENEWS #xlm $xlm #stellarorg #stellarlumens #stellar #lumens   https://t.co/OO6AB3x8zk,en,[],['https://elevenews.com/2020/12/30/stellar-lumens-cooperates-with-world-bank-to-improve-traceability-of-loans/'],[],1,6,16,"['xlm', 'stellarorg', 'stellarlumens', 'stellar', 'lumens']",['xlm']
2020-12-30 12:06:49 EST,#xlm $xlm #stellarorg  #stellarlumens #stellar #lumens 💥🚀 HERE WE GO!!!,en,[],[],[],1,0,1,"['xlm', 'stellarorg', 'stellarlumens', 'stellar', 'lumens']",['xlm']
2020-12-30 11:42:01 EST,Stellar Lumens confirmed NOT a security!   Fill your bag.,en,[],[],[],0,0,1,[],[]
2020-12-30 11:30:57 EST,Stellar Lumens cooperates with World Bank to improve traceability of loans -  https://t.co/z7txRXJ8cJ  The World Bank is working with Stellar Lumens to improve the traceability and visibilit...,en,[],['https://www.pumpmoonshot.com/news/stellar-lumens-cooperates-with-world-bank-to-improve-traceability-of-loans/'],[],0,0,0,[],[]
2020-12-30 11:10:57 EST,Stellar Lumens cooperates with World Bank to improve traceability of loans - ELEVENEWS  https://t.co/lYgbQ4848O $xlm #Stellar,en,[],['https://elevenews.com/2020/12/30/stellar-lumens-cooperates-with-world-bank-to-improve-traceability-of-loans/'],[],2,25,52,['stellar'],['xlm']
2020-12-30 11:10:38 EST,"@LeSwankJuice I have them written down I think, my computer got trashed recently so I can’t get into my personal keys/wallets for my ripple &amp; stellar lumens to see what they’ve done over the years...",en,[],[],[],0,0,0,[],[]
2020-12-30 11:03:59 EST,Stellar Lumens cooperates with World Bank to improve traceability of loans -  https://t.co/S5K6G8zSpI,en,[],['https://cryptonews19.com/stellar-lumens-cooperates-with-world-bank-to-improve-traceability-of-loans/'],[],0,0,0,[],[]
2020-12-30 10:48:13 EST,"Stellar Lumens, Dünya Bankası ile işbirliği  https://t.co/wTGLu6Wd9t",tr,[],['https://bitturkhaber.com/stellar-lumens-dunya-bankasi-ile-isbirligi/'],[],0,0,0,[],[]
2020-12-30 10:36:39 EST,@NwcPublic It’s Stated that NWC token is a Stellar Lumens Based Token   A. what are the difference/s NWC token have/has over XLM?   https://t.co/IHOn7ysgb8 it can help and provide us beginner traders assurance to get an upper hand in crypto trading industry??,en,[],['http://B.How'],[],0,0,0,[],[]
2020-12-30 10:35:06 EST,"Vaig canviar @stellar_coin  Lumens perquè m'agradava el nom. Vaig canviar @UniswapUNI  perquè m'agradava l'unicorn rosa. Però tinc més criteris: si ho diu n'@Autentic_Eloi, per exemple.",ca,"[{'screen_name': 'stellar_coin', 'name': 'lumens coin', 'id': '2707205622'}, {'screen_name': 'uniswapuni', 'name': 'uniswap protocol 🦄', 'id': '235460257'}, {'screen_name': 'autentic_eloi', 'name': 'eloi', 'id': '1274702722240045057'}]",[],[],1,0,3,[],[]
